龁 he2 "齿 chi3, 止 zhi3, 凵 kan3, 人 ren2, 乞 qi3"  禾合何和河荷核盒纥劾曷饸阂盍盉菏 2874 "龁 he2 (literary) to gnaw; to bite" 
逴 chuo4 "辶 chuo4, 卓 zhuo2, 早 zao3, 日 ri4, 囗 wei2, 十 shi2"  绰啜辍龊惙 2875 "逴 chuo4 apparent; distant; highly" 
唪 feng3 "口 kou3, 奉 feng4"  讽 2876 "唪 feng3 recite; chant" rare
翈 xia2 "甲 jia3, 日 ri4, 囗 wei2, 羽 yu3, 习 xi2, ㇀ ti2"  匣侠峡狭暇辖霞狎柙硖遐瑕黠叚 2877  
㫰 lang4 "日 ri4, 囗 wei2, 良 liang2, 艮 gen3"  浪莨阆蒗埌崀 2878 "㫰 lang4 to dry (sth) in the air" 
畤 zhi4 "田 tian2, 囗 wei2, 十 shi2, 寺 si4, 土 tu3, 寸 cun4"  至志帜制质治挚致秩掷窒智滞置稚郅 2879  
𬱖 di2 "由 you2, 日 ri4, 囗 wei2, 页 ye4, 贝 bei4, 人 ren2"  迪敌涤笛嘀狄籴荻嫡翟觌髢蹢 2880 "𬱖 di2 fine; good; beautiful" 
趼 jian3 "开 kai1, 廾 gong3, 十 shi2"  拣茧柬俭捡检减剪简碱枧笕睑锏裥戬 2881 "趼 jian3 (bound form) callus
老趼 lao3jian3 callus; corns (on the feet)
趼子 jian3zi5 callus (patch or hardened skin); corns (on the feet)
趼足 jian3zu2 feet with calluses; fig. a long and hard march
重趼 chong2jian3 thick callus" 
跂 ji1 "支 zhi1, 十 shi2, 又 you4"  讥击叽饥圾机肌鸡唧积基缉畸箕稽激 2882 "跂 ji1 foot
跂坐 qi4zuo4 to sit with legs dangling
跂想 qi3xiang3 to expect anxiously
跂望 qi4wang4 to stand on tiptoe looking forward to sb or sth
跂訾 qi3zi3 opinionated" 
蚲 ping2 "虫 chong2, 中 zhong1, 口 kou3, ㇀ ti2, 平 ping2, 干 gan4, 十 shi2"  平评坪苹凭屏瓶萍枰鲆泙玶荓帡洴 2883 "蚲 ping2 rice weevil" 
𬟽 dong1 "虫 chong2, 中 zhong1, 口 kou3, ㇀ ti2, 东 dong1, 小 xiao3, 八 ba1"  东冬咚氡鸫岽 2884 "𬟽 dong1 rainbow" 
蚺 ran2 "虫 chong2, 中 zhong1, 口 kou3, ㇀ ti2, 冉 ran3, 土 tu3, 十 shi2"  然燃髯 2885 "蚺 ran2 boa
蚺蛇 ran2she2 boa" 
啴 chan3 "口 kou3, 单 dan1, 日 ri4, 囗 wei2, 十 shi2"  产铲阐谄骣旵浐蒇𬊤冁 2886 "啴啴 chan3chan3 relaxed and leisurely
啴缓 chan3huan3 relaxed; unhurried
啴啴 chan3chan3 relaxed and leisurely" 
䎃 ran3 "冉 ran3, 土 tu3, 十 shi2, 羽 yu3, 习 xi2, ㇀ ti2"  冉染苒 2887 "䎃 ran3 (ornithology) down
粉䎃 fen3ran3 (ornithology) powder down" 
崧 song1 "山 shan1, 凵 kan3, 松 song1, 木 mu4, 十 shi2, 公 gong1, 八 ba1, 厶 si1"  松忪凇菘淞嵩娀 2888  
崟 yin2 "山 shan1, 凵 kan3, 金 jin1, 䒑 cao3"  吟银淫寅垠狺訚鄞龈夤霪珢硍龂蟫 2889 "崟 yin2 high; rugged mountains; steep" 
崞 guo1 "山 shan1, 凵 kan3, 享 xiang3, 亠 tou2, 口 kou3, 子 zi3, 了 liao3"  郭锅埚聒蝈呙 2890 "崞 guo1 name of a mountain" 
崒 cui4 "山 shan1, 凵 kan3, 卒 zu2, 十 shi2"  脆悴粹翠萃啐淬毳瘁 2891 "崒 cui4 to come together; to bunch up; to concentrate" 
崌 ju1 "山 shan1, 凵 kan3, 居 ju1, 尸 shi1, 古 gu3, 十 shi2, 口 kou3"  拘居驹鞠苴狙疽掬琚趄椐锔雎裾鞫岨 2892 "崌 ju1 mountain name" 
崡 han2 "山 shan1, 凵 kan3, 函 han2, 八 ba1"  含函涵韩寒邗邯晗焓浛琀嵅 2893  
铏 xing2 "钅 jin1, 二 er4, 刑 xing2, 开 kai1, 廾 gong3, 十 shi2, 刂 dao1"  刑行形型邢饧陉荥硎𫰛钘 2894 "铏 xing2 soup cauldron" 
𫓯 ji1 "钅 jin1, 二 er4, 圭 gui1, 土 tu3, 十 shi2"  讥击叽饥圾机肌鸡唧积基缉畸箕稽激 2895  
𫟹 hong2 "钅 jin1, 二 er4, 共 gong4, 卄 nian4, 十 shi2, 八 ba1"  弘红宏虹洪鸿闳泓竑蕻玒纮荭翃𬭎 2896  
𫟼 da2 "钅 jin1, 二 er4, 达 da2, 辶 chuo4, 大 da4, 人 ren2"  达答瘩沓怛妲笪靼鞑荙炟鿎溚 2897 "𫟼 da2 darmstadtium (chemistry)" 
铖 cheng2 "钅 jin1, 二 er4, 成 cheng2, 戊 wu4, 戈 ge1, 弋 yi4"  成呈诚承城乘程惩澄橙丞枨埕晟裎塍 2898  
铘 ye2 "钅 jin1, 二 er4, 邪 xie2, 牙 ya2, 丁 ding1, 阝 fu4"  爷揶 2899 "镆铘 mo4ye2 moye, the name of a legendary double-edged sword" rare
铚 zhi4 "钅 jin1, 二 er4, 至 zhi4, 土 tu3, 十 shi2"  至志帜制质治挚致秩掷窒智滞置稚郅 2900 "铚 zhi4 sickle" 
铞 diao4 "钅 jin1, 二 er4, 吊 diao4, 口 kou3, 巾 jin1"  吊钓调掉铫窎 2901  
铴 tang1 "钅 jin1, 二 er4, 汤 tang1, 氵 shui3, ㇀ ti2"  汤耥嘡羰镗蹚 2902  
牻 mang2 "㇀ ti2, 尨 mang2, 尤 you2, 尢 wang1, 彡 shan1"  芒忙盲氓茫邙硭杧尨厖 2903 "牻 mang2 (literary) black and white cattle" 
牿 gu4 "㇀ ti2, 告 gao4, 口 kou3"  固故顾雇梏崮锢痼鲴堌 2904 "牿 gu4 shed or pen for cattle" 
稆 lü3 "禾 he2, 木 mu4, 十 shi2, 吕 lü3, 口 kou3"  吕侣旅铝屡缕履捋膂褛梠 2905  
笱 gou3 "句 ju4, 口 kou3"  苟狗岣耇 2906 "笱 gou3 basket for trapping fish" 
笯 nu2 "奴 nu2, 女 nü3, 又 you4"  奴孥驽 2907 "笯 nu2 (literary) birdcage" 
偰 xie4 "契 qi4, 丰 feng1, 三 san1, 二 er4, 刀 dao1, 大 da4, 人 ren2"  泄泻卸屑械谢懈蟹绁亵渫榭薤獬邂廨 2908  
偡 zhan4 "甚 shen4, 卄 nian4, 十 shi2, 八 ba1"  占栈战站绽湛蘸 2909 "偡 zhan4 (literary) orderly; neat" 
鸺 xiu1 "休 xiu1, 木 mu4, 十 shi2, 鸟 niao3, 乌 wu1, 马 ma3"  休修羞咻庥貅馐髹脩䗛 2910 "鸺 xiu1 owl
鸺鹠 xiu1liu2 collared owlet (glaucidium brodiei)" 
偭 mian3 "面 mian4, 囗 wei2"  免勉缅丏沔娩冕渑湎腼勔愐𩾃 2911 "偭 mian3 to transgress" 
偲 si1 "思 si1, 田 tian2, 囗 wei2, 十 shi2, 心 xin1"  司丝私思斯撕嘶咝鸶蛳缌厮锶澌㟃虒 2912 "偲 si1 talented; urgent" 
偁 cheng1 "冉 ran3, 土 tu3, 十 shi2"  称铛撑柽琤蛏瞠赪 2913  
㿠 huang4 "白 bai2, 日 ri4, 囗 wei2, 光 guang1, 兀 wu4, 儿 er2"  晃滉 2914 "㿠 huang4 (literary) (of the face) pale due to qi and blood deficiency" rare
鄅 yu3 "禹 yu3, 阝 fu4"  与予屿宇羽雨禹语伛俣圄圉庾瘐龉窳 2915  
偓 wo4 "屋 wu1, 尸 shi1, 至 zhi4, 土 tu3, 十 shi2"  沃卧握肟幄渥斡龌硪 2916 "偓 wo4 constrained" 
徛 ji4 "彳 chi4, 奇 qi2, 大 da4, 人 ren2, 可 ke3, 丁 ding1, 口 kou3"  计记纪技忌际妓季剂迹济既继祭寄寂 2917  
衒 xuan4 "行 xing2, 彳 chi4, 亍 chu4, 丁 ding1, 玄 xuan2, 亠 tou2, 幺 yao1, 厶 si1"  炫绚渲泫眩铉楦昡琄碹 2918 "衒 xuan4 (literary) to boast; to show off" 
舳 zhu2 "舟 zhou1, 由 you2, 日 ri4, 囗 wei2"  竹逐烛竺瘃躅蠋 2919 "舳 zhu2 poopdeck; stern of boat" 
舲 ling2 "舟 zhou1, 令 ling4, 龴 jue2"  伶灵玲铃凌陵聆菱羚零龄苓囹泠瓴棂 2920 "舲 ling2 small boat with windows
鹜舲 wu4ling2 small boat" 
鸼 zhou1 "舟 zhou1, 鸟 niao3, 乌 wu1, 马 ma3"  舟州周洲粥诌辀婤赒 2921  
悆 yu4 "余 yu2, 人 ren2, 小 xiao3, 八 ba1, 心 xin1"  玉芋郁育狱浴预域欲遇喻御寓裕愈誉 2922 "悆 yu4 happy" 
鄃 shu1 "俞 yu2, 人 ren2, 刖 yue4, 月 yue4, 刂 dao1, 阝 fu4"  书抒枢叔殊梳淑舒疏输蔬纾姝倏菽摅 2923  
瓻 chi1 "希 xi1, 布 bu4, 巾 jin1, 瓦 wa3"  吃痴哧鸱蚩眵笞嗤媸螭魑𫄨摛 2924 "瓻 chi1 large wine jar" 
䝙 chu1 "豸 zhi4, 区 qu1"  出初樗䢺摴 2925  
脶 luo2 "月 yue4, 呙 guo1, 口 kou3, 内 nei4, 人 ren2"  罗萝逻锣箩骡螺猡椤 2926 "脶 luo2 fingerprint" 
脞 cuo3 "月 yue4, 坐 zuo4, 土 tu3, 十 shi2, 从 cong2, 人 ren2"   2927 "脞 cuo3 chopped meat; trifles" unique
脟 lie4 "月 yue4, 寸 cun4"  列劣烈猎裂冽洌埒捩趔躐鬣峛䴕𫚭 2928  
䏲 ti1 "月 yue4, 弟 di4, 弓 gong1"  剔梯踢锑䴘擿 2929  
鱾 ji3 "鱼 yu2, ⺈ yi4, 田 tian2, 囗 wei2, 十 shi2, 己 ji3"  几己挤脊虮戟麂掎 2930 "鱾 ji3 (bound form) fish of genus girella
斑鱾 ban1ji3 girella punctata (species of fish)" 
猇 xiao1 "犭 quan3, 虎 hu3, 虍 hu1, 七 qi1, ㇀ ti2, 儿 er2"  消宵萧硝销箫潇霄嚣枭枵哓骁逍鸮绡 2931 "猇 xiao1 the scream or roar of a tiger; to intimidate; to scare" 
猊 ni2 "犭 quan3, 臼 jiu4, 儿 er2"  尼呢泥坭怩铌倪霓鲵伲𫐐𫠜麑 2932 "猊 ni2 (mythical animal); lion; wild beast; wild horse; lion" 
猄 jing1 "犭 quan3, 京 jing1, 亠 tou2, 口 kou3, 小 xiao3, 八 ba1"  茎京经荆惊晶睛兢精鲸泾菁旌腈粳 2933  
觖 jue2 "角 jiao3, ⺈ yi4, 用 yong4, 夬 guai4, 大 da4, 人 ren2"  决诀觉绝倔掘崛爵孓抉玦珏桷厥谲蕨 2934 "觖 jue2 dissatisfied" 
𠅤 xi2 "亠 tou2, 思 si1, 田 tian2, 囗 wei2, 十 shi2, 心 xin1"  习席袭媳觋隰檄𫘬嶍鳛 2935  
庱 cheng3 "广 guang3, 厂 chang3, 夌 ling2, 土 tu3, 十 shi2, 八 ba1"  逞骋 2936  rare
庼 qing3 "广 guang3, 厂 chang3, 顷 qing3, 匕 bi3, 页 ye4, 贝 bei4, 人 ren2"  顷请苘 2937 "庼 qing3 room; small hall" 
庳 bi4 "广 guang3, 厂 chang3, 卑 bei1, 白 bai2, 日 ri4, 囗 wei2, 十 shi2"  币必毕闭庇毙痹碧蔽弊壁避臂璧畀荜 2938 "庳 bi4 low-built house" 
痓 chi4 "疒 ne4, ㇀ ti2, 广 guang3, 厂 chang3, 至 zhi4, 土 tu3, 十 shi2"  斥赤翅叱饬炽敕啻瘛彳傺 2939  
䴔 jiao1 "交 jiao1, 亠 tou2, 父 fu4, 八 ba1, 乂 yi4, 鸟 niao3, 乌 wu1, 马 ma3"  交郊浇娇骄胶椒焦跤蕉礁艽茭姣蛟鲛 2940 "䴔 jiao1 a kind of aquatic bird" 
竫 jing4 "立 li4, 亠 tou2, 䒑 cao3, 争 zheng1, ⺈ yi4"  径净竞竟敬靖静境镜胫痉婧靓迳倞 2941  
堃 kun1 "方 fang1, 万 wan4, 土 tu3, 十 shi2"  坤昆琨焜髡锟醌鲲裈婫鹍 2942  
阌 wen2 "门 men2, 受 shou4, 冖 mi4, 又 you4"  文纹闻蚊雯芠𫘜玟炆 2943 "阌 wen2 wen xiang, henan province" 
羝 di1 "羊 yang2, 䒑 cao3, 氐 di3, 氏 shi4"  低堤滴氐镝䃅鞮 2944 "羝 di1 billy goat; ram" 
羕 yang4 "永 yong3" "漾 yang4" 样漾怏恙 2945  
焆 juan1 "火 huo3, 人 ren2, 肙 yuan1, 口 kou3, 月 yue4"  捐娟鹃涓镌蠲 2946 "焆 juan1 (literary) bright" 
烺 lang3 "火 huo3, 人 ren2, 良 liang2, 艮 gen3"  朗蓢塱㮾 2947 "烺 lang3 blaze; light" 
焌 jun4 "火 huo3, 人 ren2, 厶 si1, 八 ba1"  俊峻骏竣郡捃浚珺晙葰畯䐃 2948 "焌 jun4 to set fire to; to ignite
焌油 qu1you2 to pour heated oil and seasonings over food (e.g. a cooked fish)
焌黑 jun4hei1 pitch black" 
淏 hao4 "氵 shui3, ㇀ ti2, 昊 hao4, 日 ri4, 囗 wei2, 天 tian1, 大 da4, 人 ren2"  号耗浩皓昊颢灏鄗皞 2949 "淏 hao4 (literary) (of water) limpid" 
𬇹 guo2 "氵 shui3, ㇀ ti2, 国 guo2, 囗 wei2, 玉 yu4, 土 tu3, 十 shi2"  国帼虢腘馘 2950  
淟 tian3 "氵 shui3, ㇀ ti2, 典 dian3"  舔忝殄腆晪 2951 "淟 tian3 turbid; muddy" 
淜 peng2 "氵 shui3, ㇀ ti2, 朋 peng2, 月 yue4"  朋彭棚蓬鹏澎篷膨堋硼蟛芃弸 2952 "淜 peng2 roar of dashing waves" 
淴 hu1 "氵 shui3, ㇀ ti2, 忽 hu1, 勿 wu4, 心 xin1"  乎呼忽烀唿惚滹昒轷 2953  
淯 yu4 "氵 shui3, ㇀ ti2, 育 yu4, 亠 tou2, 厶 si1"  玉芋郁育狱浴预域欲遇喻御寓裕愈誉 2954 "淯 yu4 name of river
淯水 yu4shui3 name of river" 
湴 ban4 "氵 shui3, ㇀ ti2, 䒑 cao3, 业 ye4"  办半扮伴拌绊瓣柈靽 2955 "湴 ban4 mud; slush; ooze" 
涴 wo4 "氵 shui3, ㇀ ti2, 宛 wan3, 宀 mian2, 冖 mi4, 夗 yuan4, 夕 xi1"  沃卧握肟幄渥斡龌偓硪 2956 "涴 wo4 to soil" 
𬍡 dang4 "汤 tang1, 氵 shui3, ㇀ ti2, 玉 yu4, 土 tu3, 十 shi2"  荡档凼砀宕垱菪 2957  
㥄 ling2 "忄 xin1, 夌 ling2, 土 tu3, 十 shi2, 八 ba1"  伶灵玲铃凌陵聆菱羚零龄苓囹泠瓴棂 2958  
惛 hun1 "忄 xin1, 昏 hun1, 氏 shi4, 日 ri4, 囗 wei2"  昏荤婚阍碈 2959 "惛 hun1 confused; forgetful; silly
惛耄 hun1mao4 senile; senility" 
惔 tan2 "忄 xin1, 炎 yan2, 火 huo3, 人 ren2"  坛谈痰谭潭檀昙郯倓榃锬磹 2960 "惔 tan2 to burn" 
悰 cong2 "忄 xin1, 宗 zong1, 宀 mian2, 冖 mi4, 示 shi4, 二 er4, 小 xiao3, 八 ba1"  从丛淙琮 2961 "悰 cong2 joy" 
惙 chuo4 "忄 xin1, 叕 zhuo2, 又 you4"  绰啜辍龊 2962 "惙 chuo4 mournful; uncertain
绵惙 mian2chuo4 critically ill" 
寁 zan3 "宀 mian2, 冖 mi4"  昝攒趱 2963 "寁 zan3 swift" 
逭 huan4 "辶 chuo4, 官 guan1, 宀 mian2, 冖 mi4"  幻宦换唤涣患焕痪奂浣豢漶鲩擐 2964 "逭 huan4 to escape from" 
𬤇 yin1 "讠 yan2, 垔 yin1, 口 kou3, 土 tu3, 十 shi2"  因阴茵荫音姻殷洇氤铟堙喑愔骃𬘡 2965  
𫍯 xian2 "讠 yan2, 咸 xian2, 戌 xu1, 戊 wu4, 戈 ge1, 弋 yi4, 口 kou3"  闲贤弦咸衔嫌挦涎娴舷痫鹇伭 2966 "𫍯 xian2 to bring into accord; sincerity" 
袼 ge1 "衤 yi1, 各 ge4, 口 kou3"  戈疙哥胳鸽搁割歌仡圪咯饹 2967 "袼 ge1 gusset; cloth fitting sleeve under armpit
袼褙 ge1bei4 rags used as shoes" 
裈 kun1 "衤 yi1, 军 jun1, 冖 mi4, 车 che1, 十 shi2"  坤昆琨焜髡锟醌鲲堃婫鹍 2968  
祲 jin1 "卜 bu3"  巾斤今金津筋襟衿矜𬬱珒 2969 "祲 jin1 evil force" 
𬤊 shi4 "讠 yan2, 是 shi4, 日 ri4, 囗 wei2"  士氏示世市式势事侍饰试视拭柿是适 2970 "𬤊 shi4 to examine; to judge" 
𫍲 sou3 "讠 yan2, 叟 sou3, 又 you4"  叟嗾擞薮瞍 2971 "𫍲 sou3 to induce
𫍲 sou3 to induce" 
谞 xu1 "讠 yan2, 胥 xu1, 疋 shu1, 人 ren2, 月 yue4"  吁须虚墟需盱胥顼媭嘘魆𬣙旴欻𦈡 2972 "谞 xu1 (literary) ability and wisdom; scheme; stratagem" 
艴 fu2 "弗 fu2, 弓 gong1, 色 se4, ⺈ yi4, 巴 ba1, 巳 si4"  弗伏扶芙拂服俘浮符袱幅辐福蝠凫孚 2973 "艴 fu2 angry" 
弸 peng2 "弓 gong1, 朋 peng2, 月 yue4"  朋彭棚蓬鹏澎篷膨堋硼蟛芃淜 2974 "弸 peng2 strong bow; bowstring; to fill; full" 
弶 jiang4 "弓 gong1, 京 jing1, 亠 tou2, 口 kou3, 小 xiao3, 八 ba1"  匠降将酱绛犟糨洚 2975 "弶 jiang4 snare; to snare" 
𬯎 tui2 "阝 fu4, 贵 gui4, 贝 bei4, 人 ren2"  颓魋 2976  rare
隃 yu2 "阝 fu4, 俞 yu2, 人 ren2, 刖 yue4, 月 yue4, 刂 dao1"  于余鱼娱渔隅逾渝愉榆愚舆玙欤妤盂 2977 "隃 yu2 exceed; jump over" 
婞 xing4 "女 nü3, 幸 xing4, 土 tu3, 十 shi2"  杏幸性姓荇悻 2978 "婞 xing4 upright" 
娵 ju1 "女 nü3, 取 qu3, 耳 er3, 又 you4"  拘居驹鞠苴狙疽掬琚趄椐锔雎裾鞫岨 2979 "娵 ju1 (feminine name); (star)" 
婼 chuo4 "女 nü3, 若 ruo4, 艹 cao3, 十 shi2, 右 you4, 口 kou3"  绰啜辍龊惙 2980 "婼 chuo4 recalcitrant" 
媖 ying1 "女 nü3, 英 ying1, 艹 cao3, 十 shi2, 央 yang1, 大 da4, 人 ren2"  英莺婴樱鹦鹰瑛撄嘤罂缨璎膺䓨锳 2981 "媖 ying1 (complimentary name for a woman)" 
婳 hua4 "女 nü3, 画 hua4"  化划画话桦觟 2982 "婳 hua4 tranquil" 
婍 qi3 "女 nü3, 奇 qi2, 大 da4, 人 ren2, 可 ke3, 丁 ding1, 口 kou3"  乞岂企启起芑屺杞绮玘棨 2983  
婤 zhou1 "女 nü3, 周 zhou1"  舟州周洲粥诌辀鸼赒 2984 "婤 zhou1 (feminine name)" 
婘 quan2 "女 nü3, 卷 juan3, 夫 fu1, 二 er4, 人 ren2"  权全泉拳痊诠荃铨筌蜷醛鬈颧佺辁 2985  
婠 wan1 "女 nü3, 官 guan1, 宀 mian2, 冖 mi4"  弯湾豌剜塆蜿 2986  
𬘬 qian4 "纟 si1, ㇀ ti2, 青 qing1, 土 tu3, 十 shi2, 月 yue4"  欠嵌歉芡茜倩堑椠慊伣蒨 2987 "𬘬 qian4 dark red color (of silk product)" 
𬘭 chen1 "纟 si1, ㇀ ti2, 林 lin2, 木 mu4, 十 shi2"  抻郴琛嗔瞋棽 2988 "𬘭 chen1 (literary) to stop; kindhearted" 
𬴂 fei1 "马 ma3, 非 fei1, 三 san1, 二 er4"  飞妃非菲啡绯扉蜚霏鲱 2989  
𫘦 tao2 "马 ma3, 匋 tao2, 缶 fou3, 午 wu3, 十 shi2, 凵 kan3"  逃桃陶萄淘洮啕梼绹鼗 2990  
绹 tao2 "纟 si1, ㇀ ti2, 匋 tao2, 缶 fou3, 午 wu3, 十 shi2, 凵 kan3"  逃桃陶萄淘洮啕梼𫘦鼗 2991 "绹 tao2 bind; cord; twist" 
𫟅 liang2 "纟 si1, ㇀ ti2, 京 jing1, 亠 tou2, 口 kou3, 小 xiao3, 八 ba1"  良凉梁粮粱椋俍辌墚 2992  
𬘯 zhun3 "纟 si1, ㇀ ti2, 享 xiang3, 亠 tou2, 口 kou3, 子 zi3, 了 liao3"  准 2993  rare
骕 su4 "马 ma3, 肃 su4"  诉肃素速宿粟塑溯夙涑谡嗉愫僳觫簌 2994  
𫘧 lu4 "马 ma3, 录 lu4, 彐 ji4, 八 ba1"  陆录赂鹿绿禄碌路露辂渌逯箓漉辘戮 2995 "𫘧 lu4 (horse)" 
絜 jie2 "丰 feng1, 三 san1, 二 er4, 刀 dao1, 糸 mi4, 幺 yao1, 厶 si1, 小 xiao3, 八 ba1"  节劫杰洁结桔捷睫截竭孑讦劼诘拮桀 2996 "絜 jie2 clean" 
珷 wu3 "武 wu3, 弋 yi4, 止 zhi3"  五午伍武侮捂鹉舞仵迕庑怃忤妩牾𣲘 2997 "珷 wu3 inferior gem; a kind of jade" 
琲 bei4 "非 fei1, 三 san1, 二 er4"  贝狈备背倍悖被辈惫孛邶钡焙蓓碚褙 2998 "琲 bei4 necklace" 
琡 chu4 "叔 shu1, 上 shang4, 小 xiao3, 八 ba1, 又 you4"  处畜触矗怵绌俶搐黜亍憷斶 2999  
琟 wei2 "隹 zhui1, 亠 tou2, 土 tu3, 十 shi2"  为违围唯帷惟维韦圩帏闱沩桅涠嵬潍 3000  
琔 dian4 "定 ding4, 宀 mian2, 冖 mi4"  电佃甸店玷垫淀惦奠殿坫钿靛簟癜阽 3001  
琭 lu4 "八 ba1"  陆录赂鹿绿禄碌路露辂渌逯箓漉辘戮 3002 "琭 lu4 (jade)" 
堾 chun1 "土 tu3, 十 shi2, 春 chun1, 日 ri4, 囗 wei2"  春椿蝽瑃䲠 3003  
堼 heng4 "封 feng1, 圭 gui1, 土 tu3, 十 shi2, 寸 cun4"   3004  unique
揕 zhen4 "扌 shou3, ㇀ ti2, 甚 shen4, 卄 nian4, 十 shi2, 八 ba1"  阵振震镇圳鸩朕赈纼 3005 "揕 zhen4 to hit; to thrust" 
㙘 yao1 "土 tu3, 十 shi2, 要 yao4, 口 kou3, 女 nü3"  夭吆妖腰邀幺 3006  
堧 ruan2 "土 tu3, 十 shi2, 而 er2, 大 da4, 人 ren2"   3007 "堧 ruan2 adjoin" unique
堨 e4 "土 tu3, 十 shi2, 曷 he2, 曰 yue1, 囗 wei2"  扼恶饿鄂遏愕噩鳄厄呃轭垩谔萼腭鹗 3008 "堨 e4 dam; to stop; check" 
塅 duan4 "土 tu3, 十 shi2, 段 duan4, 二 er4, 殳 shu1, 又 you4"  段断缎锻椴煅簖瑖 3009 "塅 duan4 large area of flat terrain (used in place names)" 
堠 hou4 "土 tu3, 十 shi2, 侯 hou2, 矢 shi3, 大 da4, 人 ren2"  后厚候逅鲎郈垕鲘 3010 "堠 hou4 mounds for beacons" 
絷 zhi2 "执 zhi2, 扌 shou3, ㇀ ti2, 丸 wan2, 九 jiu3, 糸 mi4, 幺 yao1, 厶 si1, 小 xiao3, 八 ba1"  执直侄值职植殖埴跖摭踯 3011 "絷 zhi2 to connect; to tie up" 
𪣻 lou3 "土 tu3, 十 shi2, 娄 lou2, 米 mi3, 木 mu4, 女 nü3"  搂篓嵝 3012 "𪣻 lou3 small mound" rare
𡎚 pian3 "土 tu3, 十 shi2, 扁 bian3, 卄 nian4"  谝 3013  rare
葜 qia1 "艹 cao3, 十 shi2, 契 qi4, 丰 feng1, 三 san1, 二 er4, 刀 dao1, 大 da4, 人 ren2"  掐袷 3014  rare
惎 ji4 "其 qi2, 共 gong4, 卄 nian4, 十 shi2, 八 ba1, 心 xin1"  计记纪技忌际妓季剂迹济既继祭寄寂 3015 "惎 ji4 injure; vilify" 
葙 xiang1 "艹 cao3, 十 shi2, 相 xiang1, 木 mu4, 目 mu4, 囗 wei2"  乡相香厢湘箱镶芗缃襄骧𬙋瓖 3016 "青葙 qing1xiang1 feather cockscomb (celosia argentea)" 
靬 jian1 "革 ge2, 干 gan4, 十 shi2"  尖奸歼坚间肩艰监兼煎菅笺犍湔缄搛 3017 "犁靬 li2jian1 han dynasty name for countries in far west; may refer to silk road states or alexandria or the roman empire" 
葴 zhen1 "艹 cao3, 十 shi2, 咸 xian2, 戌 xu1, 戊 wu4, 戈 ge1, 弋 yi4, 口 kou3"  贞针侦珍真斟帧胗桢砧祯蓁甄榛箴臻 3018 "葴 zhen1 physalis alkekengi" 
蒇 chan3 "艹 cao3, 十 shi2, 戊 wu4, 戈 ge1, 弋 yi4, 贝 bei4, 人 ren2"  产铲阐谄骣旵浐啴𬊤冁 3019 "蒇 chan3 to complete; to prepare" 
蒈 kai3 "艹 cao3, 十 shi2, 皆 jie1, 比 bi3, 匕 bi3, 白 bai2, 日 ri4, 囗 wei2"  凯慨楷剀闿恺铠锴垲 3020  
鄚 mao4 "莫 mo4, 艹 cao3, 十 shi2, 日 ri4, 囗 wei2, 大 da4, 人 ren2, 阝 fu4"  茂冒贸帽貌芼眊耄袤瑁瞀懋楙 3021  
蒉 kui4 "艹 cao3, 十 shi2, 贵 gui4, 贝 bei4, 人 ren2"  馈溃愧匮喟愦聩篑 3022 "蒉 kui4 amaranthus mangostanus" 
蓇 gu3 "艹 cao3, 十 shi2, 骨 gu3, 冖 mi4"  古谷股骨贾鼓汩诂牯罟钴蛊鹄毂榖鹘 3023 "蓇 gu3 follicle" 
蒐 sou1 "艹 cao3, 十 shi2, 鬼 gui3, 田 tian2, 囗 wei2, 儿 er2, 厶 si1"  搜艘嗖馊溲飕螋廋锼 3024 "蒐 sou1 madder (rubia cordifolia); to hunt, esp. in spring; to gather; to collect
情蒐 qing2sou1 intelligence gathering
蒐寻 sou1xun2 to look for; to search for
蒐集 sou1ji2 to gather; to collect" 
葰 jun4 "艹 cao3, 十 shi2, 俊 zun4, 厶 si1, 八 ba1"  俊峻骏竣郡捃浚珺晙焌畯䐃 3025  
葎 lü4 "艹 cao3, 十 shi2, 律 lü4, 彳 chi4, 聿 yu4, 二 er4"  律虑氯滤垏 3026 "葎 lü4 humulus japonicus" 
鄑 zi1 "晋 jin4, 亚 ya4, 业 ye4, 䒑 cao3, 日 ri4, 囗 wei2, 阝 fu4"  咨姿资滋孜淄缁辎嗞嵫孳趑锱龇髭鲻 3027 "鄑 zi1 place name" 
蒎 pai4 "艹 cao3, 十 shi2, 派 pai4, 氵 shui3, ㇀ ti2"  派湃哌 3028 "蒎 pai4 pinane" 
葖 tu2 "艹 cao3, 十 shi2, 突 tu1, 穴 xue2, 宀 mian2, 冖 mi4, 八 ba1, 犬 quan3, 大 da4, 人 ren2"  图徒途涂屠荼𬳿梌稌腯酴 3029 "葖 tu2 follicle" 
蒄 guan1 "艹 cao3, 十 shi2, 冠 guan1, 冖 mi4, 元 yuan2, 兀 wu4, 儿 er2, 寸 cun4"  关观官冠棺纶倌鳏 3030  
萹 bian1 "艹 cao3, 十 shi2, 扁 bian3, 卄 nian4"  边编蝙鞭砭笾煸鳊 3031 "萹蓄 bian1xu4 knotgrass (polygonum aviculare)" 
棤 cuo4 "木 mu4, 十 shi2, 昔 xi1, 卄 nian4, 日 ri4, 囗 wei2"  挫措错厝锉莝 3032 "棤 cuo4 rough tree bark" 
棽 chen1 "林 lin2, 木 mu4, 十 shi2, 今 jin1"  抻郴琛嗔瞋𬘭 3033  
棫 yu4 "木 mu4, 十 shi2, 或 huo4, 戈 ge1, 弋 yi4, 口 kou3, ㇀ ti2"  玉芋郁育狱浴预域欲遇喻御寓裕愈誉 3034 "棫 yu4 (oak); thorny shrub" 
椓 zhuo2 "木 mu4, 十 shi2, 豖 chu4, 豕 shi3"  灼茁卓浊酌啄琢斫浞诼擢濯镯汋叕䓬 3035 "椓 zhuo2 beat" 
椑 bei1 "木 mu4, 十 shi2, 卑 bei1, 白 bai2, 日 ri4, 囗 wei2"  杯卑悲碑鹎 3036 "椑 bei1 fagus sylvatica" 
𬃊 zhi4 "木 mu4, 十 shi2, 质 zhi4, 贝 bei4, 人 ren2"  至志帜制质治挚致秩掷窒智滞置稚郅 3037  
鹀 wu2 "巫 wu1, 工 gong1, 从 cong2, 人 ren2, 鸟 niao3, 乌 wu1, 马 ma3"  无芜吾吴梧蜈毋唔浯铻鼯郚峿珸 3038 "鹀 wu2 bunting (bird)" 
椆 chou2 "木 mu4, 十 shi2, 周 zhou1"  仇绸畴酬稠愁筹俦惆踌雠帱 3039 "椆 chou2 species of tree resistant to cold weather" 
棓 bei4 "木 mu4, 十 shi2, 咅 pou3, 立 li4, 亠 tou2, 䒑 cao3, 口 kou3"  贝狈备背倍悖被辈惫孛邶钡焙蓓碚褙 3040  
棬 quan1 "木 mu4, 十 shi2, 卷 juan3, 夫 fu1, 二 er4, 人 ren2"  圈悛𨟠 3041 "棬 quan1 bowl" 
棪 yan3 "木 mu4, 十 shi2, 炎 yan2, 火 huo3, 人 ren2"  衍掩眼演奄兖俨郾偃琰罨魇鼹沇䶮弇 3042 "棪 yan3 (tree)" 
椀 wan3 "木 mu4, 十 shi2, 宛 wan3, 宀 mian2, 冖 mi4, 夗 yuan4, 夕 xi1"  宛挽晚惋婉皖碗菀脘绾琬畹 3043  
楗 jian4 "木 mu4, 十 shi2, 建 jian4, 聿 yu4, 二 er4"  见件建荐贱剑健舰涧渐践溅鉴键槛箭 3044 "楗 jian4 material (such as rocks, earth, bamboo etc) used to hastily repair a dike; (literary) door bar (vertical bar used to prevent the horizontal movement of a door bolt)" 
𬷕 bu3 "甫 fu3, 鸟 niao3, 乌 wu1, 马 ma3"  卜补捕哺卟 3045  
甦 su1 "更 geng4, 日 ri4, 囗 wei2, 乂 yi4, 生 sheng1, 土 tu3, 十 shi2"  苏酥稣窣 3046  
酦 po1 "酉 you3, 西 xi1, 发 fa1, 又 you4"  坡泼颇钋䥽 3047 "酦 po1 to ferment alcohol" 
觌 di2 "卖 mai4, 十 shi2, 买 mai3, 头 tou2, 大 da4, 人 ren2, 见 jian4, 儿 er2"  迪敌涤笛嘀狄籴荻嫡翟𬱖髢蹢 3048 "觌 di2 face to face" 
奡 ao4 "大 da4, 人 ren2"  拗傲奥澳懊坳骜鏊岙隩薁 3049 "奡 ao4 haughty; vigorous" 
皕 bi4 "百 bai3, 白 bai2, 日 ri4, 囗 wei2" "奭 shi4, 襫 shi4" 币必毕闭庇毙痹碧蔽弊壁避臂璧畀荜 3050 "皕 bi4 two-hundred (rarely used); 200" 
硪 wo4 "石 shi2, 口 kou3, 我 wo3, 戈 ge1, 弋 yi4"  沃卧握肟幄渥斡龌偓 3051 "石硪 shi2wo4 flat stone with ropes attached, used to ram the ground" 
欹 yi1 "奇 qi2, 大 da4, 人 ren2, 可 ke3, 丁 ding1, 口 kou3, 欠 qian4, ⺈ yi4"  一伊衣医依壹祎咿铱猗揖漪噫黟洢繄 3052 "欹 yi1 interjection" 
詟 zhe2 "龙 long2, 言 yan2, 亠 tou2, 口 kou3"  折哲辙辄蛰谪磔晢喆 3053 "詟 zhe2 to be frightened" 
𫐐 ni2 "车 che1, 十 shi2, 臼 jiu4, 儿 er2"  尼呢泥坭怩铌倪霓鲵伲猊𫠜麑 3054 "𫐐 ni2 clamps for crossbar of carriage" 
辌 liang2 "车 che1, 十 shi2, 京 jing1, 亠 tou2, 口 kou3, 小 xiao3, 八 ba1"  良凉梁粮粱椋俍𫟅墚 3055 "辒辌 wen1liang2 (sleeping) carriage; hearse" 
棐 fei3 "非 fei1, 三 san1, 二 er4, 木 mu4, 十 shi2"  匪诽悱斐榧翡朏篚 3056 "棐 fei3 torreya nucifera; strengthen" 
龂 yin2 "齿 chi3, 止 zhi3, 凵 kan3, 人 ren2, 斤 jin1"  吟银淫寅垠狺訚鄞龈夤霪珢硍崟蟫 3057  
𬹼 xie4 "齿 chi3, 止 zhi3, 凵 kan3, 人 ren2, 介 jie4"  泄泻卸屑械谢懈蟹绁亵渫榭薤獬邂廨 3058  
黹 zhi3 "业 ye4, 䒑 cao3, 巾 jin1, 八 ba1" "黻 fu2, 黼 fu3" 止只旨址纸指趾芷沚祉枳咫酯徵扺轵 3059 "黹 zhi3 embroidery" 
牚 cheng4 "牙 ya2, 丁 ding1"  秤 3060  rare
睎 xi1 "目 mu4, 囗 wei2, 希 xi1, 布 bu4, 巾 jin1"  夕西吸希昔析牺息悉惜晰稀犀锡溪熙 3061 "睎 xi1 to long for; to gaze at" 
晫 zhuo2 "日 ri4, 囗 wei2, 卓 zhuo2, 早 zao3, 十 shi2"  灼茁卓浊酌啄琢斫浞诼擢濯镯汋叕䓬 3062 "晫 zhuo2 (literary) splendorous" 
晪 tian3 "日 ri4, 囗 wei2, 典 dian3"  舔忝殄腆淟 3063 "晪 tian3 (literary) bright" 
晱 shan3 "日 ri4, 囗 wei2, 炎 yan2, 火 huo3, 人 ren2"  闪陕 3064  rare
𧿹 mu3 "母 mu3"  母牡亩拇姆𬭁 3065  
蛑 mou2 "虫 chong2, 中 zhong1, 口 kou3, ㇀ ti2, 牟 mou2, 厶 si1, 牛 niu2, 十 shi2"  谋牟侔眸鍪 3066 "蛑 mou2 marine crab" 
畯 jun4 "田 tian2, 囗 wei2, 十 shi2, 厶 si1, 八 ba1"  俊峻骏竣郡捃浚珺晙焌葰䐃 3067 "畯 jun4 overseer; steppe" 
斝 jia3 "口 kou3, 冖 mi4, 斗 dou4, ㇀ ti2"  甲钾假岬胛槚瘕 3068 "斝 jia3 small jade cup with ears" 
喤 huang2 "口 kou3, 皇 huang2, 白 bai2, 日 ri4, 囗 wei2, 王 wang2, 土 tu3, 十 shi2"  皇黄凰惶煌蝗簧隍遑徨湟潢璜篁蟥鳇 3069 "喤 huang2 sobbing; sound of bell" 
崶 feng1 "山 shan1, 凵 kan3, 封 feng1, 圭 gui1, 土 tu3, 十 shi2, 寸 cun4"  丰风枫封疯峰锋蜂沣沨砜烽葑酆 3070 "崶 feng1 name of a legendary hill" 
嵁 kan1 "山 shan1, 凵 kan3, 甚 shen4, 卄 nian4, 十 shi2, 八 ba1"  刊勘堪龛戡 3071  
𫶇 die2 "山 shan1, 凵 kan3, 带 dai4, 卅 sa4, 川 chuan1, 冖 mi4, 巾 jin1"  迭谍叠碟蝶垤堞耋喋牒蹀鲽昳绖瓞 3072  
崾 yao3 "山 shan1, 凵 kan3, 要 yao4, 口 kou3, 女 nü3"  咬舀杳窈窅 3073 "崾 yao3 (name of a mountain)" 
嵅 han2 "山 shan1, 凵 kan3, 咸 xian2, 戌 xu1, 戊 wu4, 戈 ge1, 弋 yi4, 口 kou3"  含函涵韩寒邗邯晗焓浛琀崡 3074  
