餍 yan4 "厌 yan4, 厂 chang3, 犬 quan3, 大 da4, 人 ren2, 食 shi2, 良 liang2, 艮 gen3"  厌砚咽艳唁宴验谚堰雁焰彦晏焱滟酽 798 "餍 yan4 to eat to the full" 
锕 a1 "钅 jin1, 二 er4, 阿 a1, 阝 fu4, 可 ke3, 丁 ding1, 口 kou3"  阿啊吖 799 "锕 a1 actinium (chemistry)" 
麹 qu1 "麦 mai4, 土 tu3, 十 shi2, 米 mi3, 木 mu4"  区岖驱屈躯趋祛蛆蛐黢诎坥㭕𪨰胠袪 800  
泅 qiu2 "氵 shui3, ㇀ ti2, 囚 qiu2, 囗 wei2, 人 ren2"  囚求球犰虬俅酋逑赇遒巯裘訄𨱇璆 801 "泅 qiu2 to swim (bound form)
泅水 qiu2shui3 to swim
泅渡 qiu2du4 to swim across
泅游 qiu2you2 to swim" 
遒 qiu2 "辶 chuo4, 酋 qiu2, 酉 you3, 西 xi1"  囚求球犰虬泅俅酋逑赇巯裘訄𨱇璆 802 "遒 qiu2 strong; vigorous; robust; to draw near; to come to an end" 
喑 yin1 "口 kou3, 音 yin1, 立 li4, 亠 tou2, 䒑 cao3, 日 ri4, 囗 wei2"  因阴茵荫音姻殷洇氤铟堙愔骃𬘡𬤇 803 "喑 yin1 mute
喑哑 yin1ya3 hoarse; raspy" 
畦 qi2 "田 tian2, 囗 wei2, 十 shi2, 圭 gui1, 土 tu3"  齐其奇歧祈脐崎骑棋旗鳍亓祁圻芪岐 804 "畦 qi2 small plot of farm land
菜畦 cai4qi2 vegetable field; vegetable bed" 
佗 tuo2 "它 ta1, 宀 mian2, 冖 mi4, 匕 bi3"  驼鸵陀坨沱柁砣酡跎橐鼍𬶍 805 "佗 tuo2 carry on the back
华佗 hua4tuo2 hua tuo (?-208), famous doctor at the end of han dynasty" 
萜 tie1 "艹 cao3, 十 shi2, 帖 tie1, 巾 jin1, 占 zhan4, 口 kou3"  贴 806 "萜 tie1 terpene (chemistry)
萜烯 tie1xi1 terpene (chemistry)" rare
驸 fu4 "马 ma3, 付 fu4, 寸 cun4"  父付负妇附咐赴复副赋傅富腹缚覆讣 807 "驸 fu4 prince consort
驸马 fu4ma3 emperor's son-in-law" 
缡 li2 "纟 si1, ㇀ ti2, 离 li2, 亠 tou2, 凶 xiong1, 凵 kan3, 禸 rou2, 厶 si1"  厘狸离梨犁漓璃黎篱骊鹂喱蓠蜊嫠 808 "缡 li2 bridal veil or kerchief
结缡 jie2li2 to marry; to tie the bridal veil" 
钽 tan3 "钅 jin1, 二 er4, 旦 dan4, 日 ri4, 囗 wei2"  坦毯忐袒菼璮 809 "钽 tan3 tantalum (chemistry)" 
糍 ci2 "米 mi3, 木 mu4, 十 shi2, 兹 zi1, 䒑 cao3"  词兹祠瓷辞慈磁雌茨鹚茈 810 "糍 ci2 sticky rice cake
糍粑 ci2ba1 sticky rice cake" 
锘 nuo4 "钅 jin1, 二 er4, 若 ruo4, 艹 cao3, 十 shi2, 右 you4, 口 kou3"  诺懦糯喏搦 811 "锘 nuo4 nobelium (chemistry)" 
讦 jie2 "讠 yan2, 干 gan4, 十 shi2"  节劫杰洁结桔捷睫截竭孑劼诘拮桀 812 "讦 jie2 to accuse; to pry
攻讦 gong1jie2 to attack sb by exposing faults; to denounce" 
笊 zhao4 "爪 zhao3"  召兆赵照罩肇诏棹旐𬶐曌 813 "笊 zhao4 loosely woven bamboo ladle
笊篱 zhao4li5 strainer (made of bamboo, wicker, or wire)" 
溧 li4 "氵 shui3, ㇀ ti2, 栗 li4, 口 kou3, 木 mu4, 十 shi2"  力历厉立吏丽励利沥例隶荔俐莉栗砾 814 "溧 li4 name of a river" 
渼 mei3 "氵 shui3, ㇀ ti2, 美 mei3, 大 da4, 人 ren2"  每美镁浼媄 815 "渼 mei3 ripple pattern" 
狯 kuai4 "犭 quan3, 会 hui4, 人 ren2, 云 yun2, 二 er4, 厶 si1"  块快筷侩哙脍郐鲙 816 "狯 kuai4 crafty; cunning
狡狯 jiao3kuai4 (literary) crafty; cunning" 
锫 pei2 "钅 jin1, 二 er4, 咅 pou3, 立 li4, 亠 tou2, 䒑 cao3, 口 kou3"  陪培赔裴 817 "锫 pei2 berkelium (chemistry)" 
梾 lai2 "木 mu4, 十 shi2, 来 lai2, 未 wei4"  来莱崃徕涞铼俫 818 "梾木 lai2mu4 large-leaved dogwood (cornus macrophylla)" 
蚋 rui4 "虫 chong2, 中 zhong1, 口 kou3, ㇀ ti2, 内 nei4, 人 ren2"  锐瑞芮睿汭枘 819 "蚋 rui4 (mosquito); simulia lugubris; blackfly" 
铗 jia2 "钅 jin1, 二 er4, 夹 jia1, 大 da4, 人 ren2, 䒑 cao3"  颊郏荚蛱恝 820 "铗 jia2 pincers for use at a fire; sword
铗子 jia2zi5 tongs" 
玮 wei3 "韦 wei2, 二 er4"  伟伪苇尾纬委萎炜洧诿娓隗猥韪痿 821 "玮 wei3 (reddish jade); precious; rare
瑰玮 gui1wei3 ornate (style); magnificent" 
涧 jian4 "氵 shui3, ㇀ ti2, 间 jian1, 门 men2, 日 ri4, 囗 wei2"  见件建荐贱剑健舰渐践溅鉴键槛箭 822 "涧 jian4 stream
山涧 shan1jian4 mountain stream
沟涧 gou1jian4 gully; ravine
溪涧 xi1jian4 stream; mountain gorge
涧壑 jian4he4 valley; ravine" 
礴 bo2 "石 shi2, 口 kou3, 薄 bo4, 艹 cao3, 十 shi2, 溥 pu3, 氵 shui3, ㇀ ti2, 尃 fu1, 甫 fu3, 寸 cun4"  伯驳泊勃舶脖博渤搏膊薄帛钹铂亳鹁 823 "礴 bo2 to fill; to extend
磅礴 pang2bo2 majestic; boundless" 
陴 pi2 "阝 fu4, 卑 bei1, 白 bai2, 日 ri4, 囗 wei2, 十 shi2"  皮疲啤脾陂枇毗蚍铍郫琵蜱罴貔鼙 824 "陴 pi2 parapet
陴县 pi2xian4 pi county in sichuan" 
龚 gong1 "龙 long2, 共 gong4, 卄 nian4, 十 shi2, 八 ba1"  工弓公功攻供宫恭蚣躬肱觥䢼 825  
铈 shi4 "钅 jin1, 二 er4, 市 shi4, 巾 jin1"  士氏示世市式势事侍饰试视拭柿是适 826 "铈 shi4 cerium (chemistry)" 
酰 xian1 "酉 you3, 西 xi1, 先 xian1, 儿 er2"  仙先纤掀鲜氙祆籼跹锨暹忺莶𬸣孅 827 "酰 xian1 acid radical; -acyl (chemistry)
乙酰 yi3xian1 acetyl (chemistry)
酰胺 xian1an4 amide; acidamide (chemistry)" 
鼯 wu2 "鼠 shu3, 臼 jiu4, 吾 wu2, 五 wu3, 口 kou3"  无芜吾吴梧蜈毋唔浯铻郚峿珸鹀 828 "鼯 wu2 flying squirrel
鼯鼠 wu2shu3 flying squirrel" 
葩 pa1 "艹 cao3, 十 shi2, 白 bai2, 日 ri4, 囗 wei2, 巴 ba1, 巳 si4"  趴啪舥 829 "葩 pa1 corolla of flower
奇葩 qi2pa1 exotic flower; (fig.) marvel; prodigy; outlandish" 
怼 dui3 "对 dui4, 又 you4, 寸 cun4, 心 xin1"   830 "怼 dui3 to publicly criticize; to call out
回怼 hui2dui3 to hit back (at critics)
怒怼 nu4dui3 to angrily denounce
怨怼 yuan4dui4 resentment; grudge" rare
唵 an3 "口 kou3, 奄 yan1, 大 da4, 人 ren2, 电 dian4, 日 ri4, 囗 wei2"  俺埯铵 831  
桢 zhen1 "木 mu4, 十 shi2, 贞 zhen1, 贝 bei4, 人 ren2"  贞针侦珍真斟帧胗砧祯蓁甄榛箴臻 832 "桢 zhen1 evergreen shrub" 
轸 zhen3 "车 che1, 十 shi2, 彡 shan1"  诊枕疹畛缜昣袗稹鬒 833 "轸 zhen3 square; strongly (as of emotion)
轸方 zhen3fang1 square; four-square" 
耨 nou4 "耒 lei3, 未 wei4, 木 mu4, 十 shi2, 辱 ru3, 辰 chen2, 厂 chang3, 二 er4, 寸 cun4"   834 "耨 nou4 hoe; to hoe; to weed" unique
蓐 ru4 "艹 cao3, 十 shi2, 辱 ru3, 辰 chen2, 厂 chang3, 二 er4, 寸 cun4"  入褥洳溽缛 835 "蓐 ru4 mat; rushes
临蓐 lin2ru4 at childbirth; in labor" 
楹 ying2 "木 mu4, 十 shi2, 盈 ying2, 乃 nai3, 又 you4, 皿 min3"  迎荧盈莹萤营蝇赢茔萦蓥滢嬴瀛溁 836 "楹 ying2 pillar
楹联 ying2lian2 couplet (hung on the columns of a hall)" 
糁 san3 "米 mi3, 木 mu4, 十 shi2, 参 can1, 厶 si1, 大 da4, 人 ren2, 彡 shan1"  伞馓 837 "糁 san3 to mix (of powders)" rare
鹂 li2 "丽 li4, 鸟 niao3, 乌 wu1, 马 ma3"  厘狸离梨犁漓璃黎篱骊喱蓠蜊缡嫠 838 "鹂 li2 chinese oriole
黄鹂 huang2li2 yellow oriole (oriolus chinensis)" 
皲 jun1 "军 jun1, 冖 mi4, 车 che1, 十 shi2, 皮 pi2, 又 you4"  军均君钧菌筠麇莙鲪 839 "皲 jun1 to chap" 
睇 di4 "目 mu4, 囗 wei2, 弟 di4, 弓 gong1"  地弟帝递第蒂缔娣谛棣碲玓杕菂媂 840 "睇 di4 to see
凝睇 ning2di4 to gaze intently; to stare at" 
掾 yuan4 "扌 shou3, ㇀ ti2, 彖 tuan4"  苑怨院愿垸瑗 841 "掾 yuan4 official" 
辋 wang3 "车 che1, 十 shi2, 罔 wang3, 亡 wang2, 亠 tou2"  网枉往罔惘魍 842 "辋 wang3 tire; wheel band" 
锎 kai1 "钅 jin1, 二 er4"  开揩 843 "锎 kai1 californium (chemistry)" rare
钣 ban3 "钅 jin1, 二 er4, 反 fan3, 又 you4"  板版阪坂昄 844 "钣 ban3 metal plate; sheet of metal
钣金 ban3jin1 sheet metal working; auto body repair work; panel beating" 
俵 biao4 "表 biao3, 土 tu3, 十 shi2"  摽鳔 845 "俵 biao4 to distribute" rare
玢 bin1 "分 fen1, 八 ba1, 刀 dao1"  宾彬斌滨缤濒傧镔豳邠 846 "玢 bin1 (literary) a kind of jade" 
鞣 rou2 "革 ge2, 柔 rou2, 矛 mao2, 予 yu3, 龴 jue2, 木 mu4, 十 shi2"  柔揉蹂糅𫐓 847 "鞣 rou2 suede; chamois; tannin; to tan
鞣制 rou2zhi4 to tan (leather); tanning
鞣质 rou2zhi4 tannin
鞣酸 rou2suan1 tannin" 
髑 du2 "骨 gu3, 冖 mi4, 蜀 shu3, 罒 wang3, 囗 wei2"  毒独读渎椟犊牍黩 848 "髑 du2 skull" 
葚 shen4 "艹 cao3, 十 shi2, 甚 shen4, 卄 nian4, 八 ba1"  肾甚渗慎胂蜃瘆椹 849 "葚 shen4 fruit of mulberry
桑葚 sang1shen4 mulberry fruit (fructus mori)" 
悃 kun3 "忄 xin1, 困 kun4, 囗 wei2, 木 mu4, 十 shi2"  捆阃壸 850 "悃 kun3 sincere" 
碓 dui4 "石 shi2, 口 kou3, 隹 zhui1, 亠 tou2, 土 tu3, 十 shi2"  队对兑怼祋 851 "碓 dui4 pestle; pound with a pestle" 
垡 fa2 "伐 fa2, 戈 ge1, 弋 yi4, 土 tu3, 十 shi2"  乏伐罚阀筏 852 "垡 fa2 to turn the soil; upturned soil" 
镢 jue2 "钅 jin1, 二 er4, 厥 jue2, 厂 chang3, 屰 ni4, 䒑 cao3, 屮 che4, 凵 kan3, 欠 qian4, ⺈ yi4, 人 ren2"  决诀觉绝倔掘崛爵孓抉玦珏桷厥谲蕨 853  
铷 ru2 "钅 jin1, 二 er4, 如 ru2, 女 nü3, 口 kou3"  如儒蠕茹薷嚅濡孺襦嬬颥 854 "铷 ru2 rubidium (chemistry)" 
钌 liao3 "钅 jin1, 二 er4, 了 liao3"  了蓼憭 855 "钌 liao3 ruthenium (chemistry)" 
绐 dai4 "纟 si1, ㇀ ti2, 台 tai2, 厶 si1, 口 kou3"  代带贷待怠袋戴岱迨骀玳殆埭黛轪垈 856 "绐 dai4 to cheat; to pretend; to deceive" 
伛 yu3 "区 qu1"  与予屿宇羽雨禹语俣圄圉庾瘐龉窳 857 "伛 yu3 hunchbacked" 
哓 xiao1 "口 kou3, 尧 yao2, 兀 wu4, 儿 er2"  消宵萧硝销箫潇霄嚣枭枵骁逍鸮绡 858 "哓 xiao1 a cry of alarm; querulous" 
椁 guo3 "木 mu4, 十 shi2, 享 xiang3, 亠 tou2, 口 kou3, 子 zi3, 了 liao3"  果裹馃粿蜾 859 "椁 guo3 outer coffin
棺椁 guan1guo3 inner and outer coffins; coffin" 
稷 ji4 "禾 he2, 木 mu4, 十 shi2, 畟 ce4, 田 tian2, 囗 wei2, 八 ba1"  计记纪技忌际妓季剂迹济既继祭寄寂 860 "稷 ji4 millet; minister of agriculture
社稷 she4ji4 state; country; the gods of earth and grain" 
瘿 ying3 "疒 ne4, ㇀ ti2, 广 guang3, 厂 chang3, 婴 ying1, 女 nü3"  颖影郢颍 861 "瘿 ying3 goiter; knob on tree" 
淮 huai2 "氵 shui3, ㇀ ti2, 隹 zhui1, 亠 tou2, 土 tu3, 十 shi2"  怀徊槐踝 862 "淮 huai2 river name
淮北 huai2bei3 huaibei prefecture-level city in anhui
淮南 huai2nan2 huainan prefecture-level city in anhui
淮安 huai2an1 huai'an prefecture-level city in jiangsu
淮山 huai2shan1 chinese yam (dioscorea polystachya), aka nagaimo" 
钔 men2 "钅 jin1, 二 er4, 门 men2"  门扪𫞩 863 "钔 men2 mendelevium (chemistry)" 
铕 you3 "钅 jin1, 二 er4, 有 you3, 月 yue4"  友有酉卣羑莠牖黝槱 864 "铕 you3 europium (chemistry)" 
趄 ju1 "走 zou3, 土 tu3, 十 shi2, 人 ren2, 且 qie3"  拘居驹鞠苴狙疽掬琚椐锔雎裾鞫岨 865 "趄 ju1 to hesitate; to mark time
趔趄 lie4qie5 to stagger; to stumble; to reel
趑趄 zi1ju1 to advance with difficulty; to hesitate to advance" 
冼 xian3 "㇀ ti2, 先 xian1, 儿 er2"  显险蚬猃跣藓燹狝崄筅禒㬎 866  
籥 yue4 "龠 yue4, 人 ren2"  月岳阅悦跃越粤刖玥钺樾龠𫐄𬸚瀹爚 867 "籥 yue4 flute; key" 
遽 ju4 "辶 chuo4, 豦 qu2, 虍 hu1, 七 qi1, ㇀ ti2, 豕 shi3" "蘧 qu2" 巨句拒具炬俱剧据距惧锯聚讵苣倨犋 868 "遽 ju4 hurry; fast; suddenly
匆遽 cong1ju4 hurried; impetuous; rash
急遽 ji2ju4 rapid; sudden
惶遽 huang2ju4 frightened; anxious
遽然 ju4ran2 (literary) all of a sudden" 
梃 ting3 "木 mu4, 十 shi2, 廷 ting2"  挺艇铤圢侹珽烶颋 869 "梃 ting3 a club (weapon)" 
樯 qiang2 "木 mu4, 十 shi2, 啬 se4, 土 tu3, 回 hui2, 囗 wei2, 口 kou3"  强墙蔷嫱蔃 870 "樯 qiang2 boom; mast" 
樘 cheng3 "木 mu4, 十 shi2, 堂 tang2, 土 tu3"  逞骋庱 871 "樘 cheng3 a pillar" rare
匾 bian3 "扁 bian3, 卄 nian4, 十 shi2"  贬扁褊碥 872 "匾 bian3 plaque; tablet; basket
牌匾 pai2bian3 board (attached to a wall)
匾额 bian3e2 a horizontal inscribed board
横匾 heng2bian3 horizontal tablet (for an inscription)" 
兕 si4 "凹 ao1, 凵 kan3, 儿 er2"  巳四寺似祀饲肆汜姒泗驷耜笥嗣涘 873  
苷 gan1 "艹 cao3, 十 shi2, 甘 gan1, 廿 nian4, 卄 nian4"  干甘杆肝柑竿尴玕坩矸泔酐疳虷 874 "苷 gan1 licorice; glycoside
糖苷 tang2gan1 glucoside
核苷 he2gan1 nucleoside
氰苷 qing2gan1 cyanogenetic glucoside
腺苷 xian4gan1 adenosine" 
漕 cao2 "氵 shui3, ㇀ ti2, 曹 cao2, 曲 qu1, 曰 yue1, 囗 wei2"  曹槽嘈螬𥕢艚 875 "漕 cao2 to transport (esp. grain) by water; (literary) watercourse; canal
漕运 cao2yun4 to ship grain as tax" 
碇 ding4 "石 shi2, 口 kou3, 定 ding4, 宀 mian2, 冖 mi4"  订定啶腚锭萣 876 "碇 ding4 anchor
碇泊 ding4bo2 to moor; to drop anchor" 
铯 se4 "钅 jin1, 二 er4, 色 se4, ⺈ yi4, 巴 ba1, 巳 si4"  色涩瑟塞啬穑璱 877 "铯 se4 cesium (chemistry)" 
胍 gua1 "月 yue4, 瓜 gua1, 厶 si1"  瓜刮栝鸹 878 "胍 gua1 guanidine" 
趔 lie4 "走 zou3, 土 tu3, 十 shi2, 人 ren2, 列 lie4, 歹 dai3, 夕 xi1, 刂 dao1"  列劣烈猎裂冽洌埒捩躐鬣峛䴕脟𫚭 879 "趔 lie4 stumble
趔趄 lie4qie5 to stagger; to stumble; to reel" 
骟 shan4 "马 ma3, 扇 shan4, 羽 yu3, 习 xi2, ㇀ ti2"  扇善擅赡讪汕疝剡鄯缮膳嬗蟮鳝𫮃 880 "骟 shan4 to geld" 
笳 jia1 "加 jia1, 力 li4, 口 kou3"  加夹佳家嘉迦珈枷浃痂袈葭跏镓泇 881 "笳 jia1 whistle made of reed" 
鲲 kun1 "鱼 yu2, ⺈ yi4, 田 tian2, 囗 wei2, 十 shi2, 昆 kun1, 日 ri4, 比 bi3, 匕 bi3"  坤昆琨焜髡锟醌堃裈婫鹍 882 "鲲 kun1 fry (newly hatched fish)
鲲鹏 kun1peng2 peng, a gigantic bird transformed from the kun" 
镞 zu2 "钅 jin1, 二 er4, 族 zu2, 矢 shi3, 大 da4, 人 ren2"  足卒族崒 883 "镞 zu2 arrowhead; sharp
箭镞 jian4zu2 arrowhead" 
颀 qi2 "斤 jin1, 页 ye4, 贝 bei4, 人 ren2"  齐其奇歧祈脐崎骑棋旗鳍亓祁圻芪岐 884 "颀 qi2 tall" 
奁 lian2 "大 da4, 人 ren2, 区 qu1"  连怜帘莲联廉镰涟梿裢鲢濂蠊 885 "奁 lian2 bridal trousseau
妆奁 zhuang1lian2 trousseau; lady's dressing case
陪奁 pei2lian2 dowry" 
啉 lin2 "口 kou3, 林 lin2, 木 mu4, 十 shi2"  邻林临淋琳磷鳞粼嶙遴璘霖辚麟箖 886  
缯 zeng1 "纟 si1, ㇀ ti2, 曾 ceng2"  增憎罾鄫矰䎖 887 "缯 zeng1 silk fabrics" 
牝 pin4 "牛 niu2, 十 shi2, 匕 bi3"  聘 888 "牝 pin4 (of a bird, animal or plant) female; keyhole; valley
牝牡 pin4mu3 male and female" rare
狲 sun1 "犭 quan3, 孙 sun1, 子 zi3, 了 liao3, 小 xiao3, 八 ba1"  孙荪飧 889 "狲 sun1 (monkey)
猢狲 hu2sun1 macaque" 
氤 yin1 "气 qi4, 因 yin1, 囗 wei2, 大 da4, 人 ren2"  因阴茵荫音姻殷洇铟堙喑愔骃𬘡𬤇 890 "氤 yin1 generative forces; magic emanation
氤氲 yin1yun1 (literary) (of smoke, mist) dense; thick" 
澹 dan4 "氵 shui3, ㇀ ti2, 詹 zhan1, ⺈ yi4, 厂 chang3, 八 ba1, 言 yan2, 亠 tou2, 口 kou3"  旦但诞淡弹蛋氮萏啖惮膻𫢸疍憺 891 "澹 dan4 tranquil; placid; quiet" 
蘩 fan2 "艹 cao3, 十 shi2, 繁 fan2, 敏 min3, 每 mei3, 母 mu3, 攵 pu1, 乂 yi4, 糸 mi4, 幺 yao1, 厶 si1, 小 xiao3, 八 ba1"  凡矾烦繁钒樊璠燔氾墦𫔍𬸪蹯 892 "蘩 fan2 artemisia stellariana" 
棣 di4 "木 mu4, 十 shi2, 隶 li4, 八 ba1"  地弟帝递第蒂缔娣谛睇碲玓杕菂媂 893 "棣 di4 kerria japonica
唐棣 tang2di4 shadbush or shadberry (genus amelanchier)" 
陇 long3 "阝 fu4, 龙 long2"  拢垄𬕂 894 "陇南 long3nan2 longnan prefecture-level city in south gansu
陇海 long3hai3 jiangsu-gansu railway" 
苕 tiao2 "艹 cao3, 十 shi2, 召 zhao4, 刀 dao1, 口 kou3"  条迢笤蜩髫龆鲦 895 "苕 tiao2 reed grass" 
奘 zang4 "爿 pan2, 士 shi4, 十 shi2, 大 da4, 人 ren2"  葬 896 "奘 zang4 great" rare
唛 mai4 "口 kou3, 麦 mai4, 土 tu3, 十 shi2"  迈麦卖脉劢鿏 897 "唛头 mai4tou2 trademark; shipping mark" 
嫚 man4 "女 nü3, 曼 man4, 曰 yue1, 囗 wei2, 罒 wang3, 又 you4"  曼蔓漫慢谩墁幔缦镘𬜬 898 "嫚 man4 insult" 
璇 xuan2 "旋 xuan2, 疋 shu1, 人 ren2"  玄悬旋漩𫠊玹痃暶 899 "璇 xuan2 (jade)
天璇 tian1xuan2 beta ursae majoris in the big dipper" 
萼 e4 "艹 cao3, 十 shi2, 咢 e4, 口 kou3, 亏 kui1"  扼恶饿鄂遏愕噩鳄厄呃轭垩谔腭鹗 900 "萼 e4 calyx of a flower
糖萼 tang2e4 glycocalyx
花萼 hua1e4 sepal" 
煊 xuan1 "火 huo3, 人 ren2, 宣 xuan1, 宀 mian2, 冖 mi4, 亘 gen4, 旦 dan4, 日 ri4, 囗 wei2"  轩宣喧谖萱瑄暄咺𫓶愃儇禤𫍽嬛翾 901  
垆 lu2 "土 tu3, 十 shi2, 卢 lu2, 尸 shi1"  卢芦庐炉颅泸栌轳胪鸬舻鲈𬬻 902 "垆 lu2 clay; shop" 
锝 de2 "钅 jin1, 二 er4, 旦 dan4, 日 ri4, 囗 wei2, 寸 cun4"  得德 903 "锝 de2 technetium (chemistry)" rare
肫 zhun1 "月 yue4, 屯 tun2"  谆窀衠 904 "肫 zhun1 gizzard" 
赈 zhen4 "贝 bei4, 人 ren2, 辰 chen2, 厂 chang3, 二 er4"  阵振震镇圳鸩朕纼揕 905 "赈 zhen4 to provide relief; to aid
赈恤 zhen4xu4 relief aid
赈捐 zhen4juan1 money donation to relieve distress or famine
赈济 zhen4ji4 to give relief aid
赈灾 zhen4zai1 disaster relief" 
栲 kao3 "木 mu4, 十 shi2, 考 kao3, 土 tu3"  考拷烤洘 906 "栲 kao3 chinquapin (castanopsis fargesii and other spp.), genus of evergreen trees
栲属 kao3shu3 castanopsis, genus of evergreen trees
栲栳 kao3lao3 round-bottomed wicker basket
栲胶 kao3jiao1 tannin" 
铥 diu1 "钅 jin1, 二 er4, 丢 diu1, 去 qu4, 土 tu3, 十 shi2, 厶 si1"  丢 907 "铥 diu1 thulium (chemistry)" rare
黩 du2 "黑 hei1, 土 tu3, 十 shi2, 口 kou3, 灬 huo3, 卖 mai4, 买 mai3, 头 tou2, 大 da4, 人 ren2"  毒独读渎椟犊牍髑 908 "黩 du2 blacken; constantly; to insult
黩武 du2wu3 militaristic; to use military force indiscriminately
亵黩 xie4du2 to blaspheme; to profane" 
谵 zhan1 "讠 yan2, 詹 zhan1, ⺈ yi4, 厂 chang3, 八 ba1, 言 yan2, 亠 tou2, 口 kou3"  沾毡粘瞻旃詹栴𫗴鹯鳣 909 "谵 zhan1 (literary) to rant; to rave; to be delirious
谵妄 zhan1wang4 delirium" 
竦 song3 "立 li4, 亠 tou2, 䒑 cao3, 束 shu4, 木 mu4, 十 shi2, 口 kou3"  耸㧐怂悚 910 "竦 song3 respectful; horrified; to raise (one's shoulders); to stand on tiptoe; to crane" 
诰 gao4 "讠 yan2, 告 gao4, 口 kou3"  告郜锆筶 911 "诰 gao4 to enjoin; to grant (a title)" 
艄 shao1 "舟 zhou1, 肖 xiao4, 月 yue4"  捎烧梢稍蛸筲 912 "艄 shao1 stern of boat
船艄 chuan2shao1 stern of boat
艄公 shao1gong1 helmsman; boatman" 
嫔 pin2 "女 nü3, 宾 bin1, 宀 mian2, 冖 mi4, 兵 bing1, 丘 qiu1, 斤 jin1, 八 ba1"  贫频玭颦𬞟 913 "嫔 pin2 imperial concubine
嫔妃 pin2fei1 imperial concubine
妃嫔 fei1pin2 imperial concubine" 
捯 dao2 "扌 shou3, ㇀ ti2, 到 dao4, 至 zhi4, 土 tu3, 十 shi2, 刂 dao1"   914 "捯 dao2 (coll.) to reel in (string, yarn etc) by pulling hand over hand or by coiling; to step along; to look into; to pursue (a matter)
捯饬 dao2chi5 (coll.) to doll up; to spruce up; to zhoosh up" unique
钷 po3 "钅 jin1, 二 er4, 叵 po3, 口 kou3"  叵笸 915 "钷 po3 promethium (chemistry)" rare
蘖 nie4 "薛 xue1, 艹 cao3, 十 shi2, 辛 xin1, 立 li4, 亠 tou2, 䒑 cao3, 木 mu4"  聂孽臬涅啮嗫镊镍颞蹑陧菍嵲𫔶糵 916 "蘖 nie4 new shoot growing from cut branch or stump
分蘖 fen1nie4 tiller (stem at the base of grass plants)
蘖枝 nie4zhi1 branch stem" 
氲 yun1 "气 qi4, 日 ri4, 囗 wei2, 皿 min3"  晕赟煴𫖳馧 917 "氲 yun1 heavy atmosphere
氤氲 yin1yun1 (literary) (of smoke, mist) dense; thick" 
镌 juan1 "钅 jin1, 二 er4, 隽 juan4, 隹 zhui1, 亠 tou2, 土 tu3, 十 shi2, 乃 nai3"  捐娟鹃涓蠲焆 918 "镌 juan1 to engrave (on wood or stone); to inscribe
镌刻 juan1ke4 to engrave
镌镂 juan1lou4 to engrave
镌黜 juan1chu4 to dismiss an official
雕镌 diao1juan1 to engrave (wood or stone); to carve" 
帑 tang3 "奴 nu2, 女 nü3, 又 you4, 巾 jin1"  倘淌躺傥埫镋 919 "帑 tang3 state treasury; public funds
帑藏 tang3zang4 state treasury" 
莘 shen1 "艹 cao3, 十 shi2, 辛 xin1, 立 li4, 亠 tou2, 䒑 cao3"  申伸身呻绅深诜砷娠屾侁珅𬳽甡鲹 920 "莘 shen1 long; numerous
莘莘 shen1shen1 numerous" 
嗌 ai4 "口 kou3, 益 yi4, 䒑 cao3, 八 ba1, 皿 min3"  艾爱隘碍砹嫒叆暧瑷 921 "嗌 ai4 (literary) to choke; to have a blockage in the throat" 
殂 cu2 "歹 dai3, 夕 xi1, 且 qie3"  徂 922 "殂 cu2 to die
崩殂 beng1cu2 to die" rare
惇 dun1 "忄 xin1, 享 xiang3, 亠 tou2, 口 kou3, 子 zi3, 了 liao3"  吨敦墩蹲礅镦蹾 923 "惇 dun1 kindhearted; honest" 
钕 nü3 "钅 jin1, 二 er4, 女 nü3"  女 924 "钕 nü3 neodymium (chemistry)" rare
嗔 chen1 "口 kou3, 真 zhen1, 十 shi2, 具 ju4, 三 san1, 二 er4, 八 ba1"  抻郴琛瞋𬘭棽 925 "嗔 chen1 to be angry at; to be displeased and annoyed
嗔喝 chen1he4 to yell at sb in rage
嗔怒 chen1nu4 to get angry
嗔怨 chen1yuan4 to complain; to reproach
嗔怪 chen1guai4 to blame; to rebuke" 
泚 ci3 "氵 shui3, ㇀ ti2, 此 ci3, 止 zhi3, 匕 bi3"  此玼𫚖 926 "泚 ci3 clear; bright and brilliant" 
搛 jian1 "扌 shou3, ㇀ ti2, 兼 jian1, 䒑 cao3, 卄 nian4, 十 shi2, 八 ba1"  尖奸歼坚间肩艰监兼煎菅笺犍湔缄 927 "搛 jian1 to pick up with chopsticks" 
苴 ju1 "艹 cao3, 十 shi2, 且 qie3"  拘居驹鞠狙疽掬琚趄椐锔雎裾鞫岨 928 "苴 ju1 (hemp); sack cloth
苴麻 ju1ma2 female hemp plant (cannabis sativa)" 
嗐 hai4 "口 kou3, 害 hai4, 宀 mian2, 冖 mi4, 丰 feng1, 三 san1, 二 er4"  亥骇害氦 929 "嗐 hai4 exclamation of regret" 
铼 lai2 "钅 jin1, 二 er4, 来 lai2, 未 wei4, 木 mu4, 十 shi2"  来莱崃徕涞俫梾 930 "铼 lai2 rhenium (chemistry)" 
沂 yi2 "氵 shui3, ㇀ ti2, 斤 jin1"  仪夷怡宜贻姨胰移遗疑匜圯诒迤饴 931 "沂 yi2 yi river, shandong
临沂 lin2yi2 linyi prefecture-level city in shandong" 
枰 ping2 "木 mu4, 十 shi2, 平 ping2, 干 gan4"  平评坪苹凭屏瓶萍鲆泙玶荓帡洴蚲 932 "枰 ping2 chess-like game" 
镧 lan2 "钅 jin1, 二 er4, 阑 lan2, 门 men2, 柬 jian3, 束 shu4, 木 mu4, 十 shi2, 口 kou3"  兰拦栏婪蓝澜篮岚阑谰褴斓𬒗襕 933 "镧 lan2 lanthanum (chemistry)" 
跬 kui3 "圭 gui1, 土 tu3, 十 shi2"  傀𫠆煃 934 "跬 kui3 brief; short step" 
枥 li4 "木 mu4, 十 shi2, 历 li4, 厂 chang3, 力 li4"  力历厉立吏丽励利沥例隶荔俐莉栗砾 935 "枥 li4 type of oak; stable (for horses)" 
鲳 chang1 "鱼 yu2, ⺈ yi4, 田 tian2, 囗 wei2, 十 shi2, 昌 chang1, 日 ri4, 曰 yue1"  昌猖伥菖阊娼 936 "乌鲳 wu1chang1 black pomfret
银鲳 yin2chang1 silvery pomfret; dollarfish; harvestfish
鲳鱼 chang1yu2 silvery pomfret; butterfish" 
芷 zhi3 "艹 cao3, 十 shi2, 止 zhi3"  止只旨址纸指趾沚祉枳咫酯徵扺轵 937 "芷 zhi3 angelica (type of iris); plant root used in tcm
白芷 bai2zhi3 dahurian angelica (angelica dahurica)" 
镮 huan2 "钅 jin1, 二 er4, 罒 wang3, 囗 wei2"  还环郇洹桓萑圜寰缳鹮鬟荁峘𬘫貆锾 938 "镮 huan2 metal ring" 
侪 chai2 "齐 qi2, 文 wen2, 亠 tou2, 乂 yi4"  柴豺 939 "侪 chai2 a class; a company; companion
同侪 tong2chai2 peer; member of the same class, generation or social group" rare
椐 ju1 "木 mu4, 十 shi2, 居 ju1, 尸 shi1, 古 gu3, 口 kou3"  拘居驹鞠苴狙疽掬琚趄锔雎裾鞫岨 940 "椐 ju1 zelkowa acuminata" 
谪 zhe2 "讠 yan2, 亠 tou2, 古 gu3, 十 shi2, 口 kou3"  折哲辙辄蛰磔晢喆詟 941 "谪 zhe2 to relegate a high official to a minor post in an outlying region (punishment in imperial china); to banish or exile; (of immortals) to banish from heaven; to censure; to blame
贬谪 bian3zhe2 to banish from the court; to relegate
指谪 zhi3zhe2 to criticize
谪仙 zhe2xian1 (fig.) banished official
谪居 zhe2ju1 (of officials in imperial china) to live in banishment" 
镄 fei4 "钅 jin1, 二 er4, 费 fei4, 弗 fu2, 弓 gong1, 贝 bei4, 人 ren2"  吠肺废沸费芾狒痱剕 942 "镄 fei4 fermium (chemistry)" 
苡 yi3 "艹 cao3, 十 shi2, 以 yi3, 人 ren2"  乙已以矣蚁倚椅钇旖佁舣酏扆𫖮踦 943 "苡 yi3 common plantain (plantago major)
薏苡 yi4yi3 job's tears plant (coix lacryma-jobi); chinese pearl barley" 
莠 you3 "艹 cao3, 十 shi2, 秀 xiu4, 禾 he2, 木 mu4, 乃 nai3"  友有酉卣羑牖黝铕槱 944 "莠 you3 setaria viridis; vicious" 
钫 fang1 "钅 jin1, 二 er4, 方 fang1, 万 wan4"  方坊芳枋邡牥蚄 945 "钫 fang1 francium (chemistry)" 
豐  "豆 dou4, 䒑 cao3" "酆 feng1"  946  rare
蠓 meng3 "虫 chong2, 中 zhong1, 口 kou3, ㇀ ti2, 蒙 meng2, 艹 cao3, 十 shi2, 冖 mi4, 豕 shi3"  猛锰勐蜢艋獴懵 947 "蠓 meng3 grasshopper; midge; sandfly
蠛蠓 mie4meng3 midge" 
蚍 pi2 "虫 chong2, 中 zhong1, 口 kou3, ㇀ ti2, 比 bi3, 匕 bi3"  皮疲啤脾陂枇毗铍郫琵蜱罴貔鼙陴 948 "蚍蜉 pi2fu2 a type of large ant" 
茏 long2 "艹 cao3, 十 shi2, 龙 long2"  龙咙胧聋笼隆窿泷珑栊砻眬癃昽漋 949 "茏 long2 polygonum posumbu
葱茏 cong1long2 verdant and lush
蒙茏 meng2long2 dense (of foliage)" 
苎 zhu4 "艹 cao3, 十 shi2, 㝉 zhu4, 宀 mian2, 冖 mi4"  助住贮注驻柱祝著蛀铸筑伫杼炷翥 950 "苎 zhu4 boehmeria nivea; chinese grass
苎麻 zhu4ma2 rush (tall grass); bulrush; boehmeria; ramie
麻苎 ma2zhu4 hemp and ramie; coarse cloth" 
擢 zhuo2 "扌 shou3, ㇀ ti2, 翟 di2, 羽 yu3, 习 xi2, 隹 zhui1, 亠 tou2, 土 tu3, 十 shi2"  灼茁卓浊酌啄琢斫浞诼濯镯汋叕䓬 951 "擢 zhuo2 to pull out; to select; to promote
拔擢 ba2zhuo2 select the best people for promotion
擢升 zhuo2sheng1 to promote (sb); to upgrade; to ascend
擢第 zhuo2di4 to pass the civil service examination (in imperial china)" 
赧 nan3 "赤 chi4, 土 tu3, 十 shi2, 小 xiao3, 八 ba1"  腩蝻 952 "赧 nan3 blushing with shame
愧赧 kui4nan3 to blush in shame; red-faced
羞赧 xiu1nan3 (literary) embarrassed; bashful
赧然 nan3ran2 blushing; embarrassed" rare
滦 luan2 "氵 shui3, ㇀ ti2, 栾 luan2, 木 mu4, 十 shi2"  峦孪娈栾挛鸾脔銮 953 "滦 luan2 river and county in hebei province
滦河 luan2he2 luan river" 
膑 bin4 "月 yue4, 宾 bin1, 宀 mian2, 冖 mi4, 兵 bing1, 丘 qiu1, 斤 jin1, 八 ba1"  鬓摈殡髌 954 "膑刑 bin4xing2 removal of the kneecaps (punishment)" 
鹄 hu2 "告 gao4, 口 kou3, 鸟 niao3, 乌 wu1, 马 ma3"  狐弧胡壶葫湖蝴糊囫斛猢瑚煳鹕槲縠 955 "鹄 gu3 goal; target
鸿鹄 hong2hu2 swan; person with noble aspirations
