了 le le/che1/xue3/chuang3/pen1 "了 le5 (completed action marker); (modal particle indicating change of state, situation now); (modal particle intensifying preceding clause)
为了 wei4le5 for; for the purpose of; in order to
到了 dao4liao3 at last; finally; in the end
了解 liao3jie3 to understand; to realize; to find out; to understand; to realize; to find out
除了 chu2le5 besides; apart from (... also...); in addition to; except (for)" 0
我 wo3 shi/za2/wo3/mi1/ga3 "我 wo3 i; me; my
我们 wo3men5 we; us; ourselves; our
我国 wo3guo2 our country; china
自我 zi4wo3 self-; ego (psychology)
我方 wo3fang1 our side; we" 1
和 huo5 na3/ga3/huo5/cuo3/guang4 "和 he2 (joining two nouns) and; together with; (math.) sum; to make peace; (sports) to draw; to tie; (bound form) harmonious; harmonious
和平 he2ping2 peace; peaceful
和谐 he2xie2 harmonious; harmony; (euphemism) to censor
温和 wen1he2 mild; gentle; moderate
平和 ping2he2 gentle; mild; moderate; placid" 2
说 shuo1 shuo1/dei3/lo5/diu1/lao1 "说 shuo1 to speak; to talk; to say; to explain; to comment; to scold; to tell off; (bound form) theory; doctrine
说话 shuo1hua4 to speak; to say; to talk; to gossip; to tell stories; talk; word
说明 shuo1ming2 to explain; to illustrate; to indicate; to show; to prove; explanation; directions; caption
小说 xiao3shuo1 novel; fiction
听说 ting1shuo1 to hear (sth said); one hears (that); hearsay; listening and speaking" 3
着 zhao2 ri4/wo3/xiong2/zhao2/nen4 "着 zhe5 aspect particle indicating action in progress
接着 jie1zhe5 to catch and hold on; to continue; to go on to do sth; to follow; to carry on; then; after that; subsequently; to proceed; to ensue; in turn; in one's turn
随着 sui2zhe5 along with; in the wake of; following
跟着 gen1zhe5 to follow after; immediately afterwards
穿着 chuan1zhuo2 attire; clothes; dress" 4
着 zhe5 zhe5/ne2/mang1/chao3/na1 "着 zhe5 aspect particle indicating action in progress
接着 jie1zhe5 to catch and hold on; to continue; to go on to do sth; to follow; to carry on; then; after that; subsequently; to proceed; to ensue; in turn; in one's turn
随着 sui2zhe5 along with; in the wake of; following
跟着 gen1zhe5 to follow after; immediately afterwards
穿着 chuan1zhuo2 attire; clothes; dress" 5
地 de qin3/ng2/lie1/tang4/de "地 de5 -ly; structural particle: used before a verb or adjective, linking it to preceding modifying adverbial adjunct
地方 di4fang5 area; place; space; room; territory
地区 di4qu1 local; regional; district (not necessarily formal administrative unit); region; area; as suffix to city name, means prefecture or county (area administered by a prefecture-level city or, county-level city)
地址 di4zhi3 address
地上 di4shang5 on the ground; on the floor" 6
那 na1 na1/cu2/jia5/yo1 "那 na4 (specifier) that; the; (pronoun) that (referring to persons, things or situations); then (in that case)
那么 na4me5 like that; in that way; or so; so; so very much; about; in that case
那个 na4ge5 that one; that thing; that (as opposed to this); (used before a verb or adjective for emphasis); (used to humorously or indirectly refer to sth embarrassing, funny etc, or when one can't think of the right word); (euph.) menstruation; sex
那些 na4xie1 those
那样 na4yang4 that kind; that sort" 7
大 da4 lu/shuan4/dong3/da4/shao3 "大 da4 big; large; great; older (than another person); greatly; freely; fully; (dialect) father; (dialect) uncle (father's brother)
大家 da4jia1 everyone; influential family; great expert
大学 da4xue2 university; college
大概 da4gai4 roughly; probably; rough; approximate; about; general idea
大陆 da4lu4 mainland china (reference to the prc); continent; mainland" 8
好 hao3 luan3/hao3/yo1/che3/fa3 "好 hao3 good; appropriate; proper; (before a verb) easy to; (before a verb) good to; (before an adjective for exclamatory effect) so; (verb complement indicating completion); (of two people) close; on intimate terms; (after a personal pronoun) hello
不好 bu4hao3 no good
好像 hao3xiang4 as if; to seem like
最好 zui4hao3 best; (you) had better (do what we suggest)
只好 zhi3hao3 to have no other option but to ...; to have to; to be forced to" 9
得 de5 zou3/kuan3/de5/sao3/man3 "得 de5 structural particle: used after a verb (or adjective as main verb), linking it to following phrase indicating effect, degree, possibility etc
觉得 jue2de5 to think that ...; to feel that ...; to feel (uncomfortable etc)
得到 de2dao4 to get; to obtain; to receive
记得 ji4de5 to remember
获得 huo4de2 to obtain; to receive; to get" 10
得 dei3 die1/chen3/dei3/nao1/a4 "得 de5 structural particle: used after a verb (or adjective as main verb), linking it to following phrase indicating effect, degree, possibility etc
觉得 jue2de5 to think that ...; to feel that ...; to feel (uncomfortable etc)
得到 de2dao4 to get; to obtain; to receive
记得 ji4de5 to remember
获得 huo4de2 to obtain; to receive; to get" 11
给 gei3 sui3/ni1/niu4/gei3/chong4 "给 gei3 to; for; for the benefit of; to give; to allow; to do sth (for sb); (sentence intensifier)
交给 jiao1gei3 to give; to deliver; to hand over
送给 song4gei3 to send; to give as a present
给予 ji3yu3 to accord; to give; to show (respect)
递给 di4gei3 to hand it (i.e. the aforementioned item) to (sb)" 12
让 rang4 tou1/shuan4/rang4/nuan3/en4 "让 rang4 to yield; to permit; to let sb do sth; to have sb do sth; to make sb (feel sad etc)
转让 zhuan3rang4 to transfer (ownership, rights etc)
让步 rang4bu4 to concede; to give in; to yield; a concession; (linguistics) concessive
让开 rang4kai1 to get out of the way; to step aside
让座 rang4zuo4 to give up one's seat for sb" 13
日 ri4 qia3/leng1/duan3/ri4/a3 "日 ri4 sun; day; date, day of the month
日本 ri4ben3 japan
日子 ri4zi5 day; a (calendar) date; days of one's life
日期 ri4qi1 date
日记 ri4ji4 diary" 14
能 neng2 cun4/seng1/zan1/shuai3/neng2 "能 neng2 can; to be able to; might possibly; ability; (physics) energy
不能 bu4neng2 cannot; must not; should not
可能 ke3neng2 might (happen); possible; probable; possibility; probability; maybe; perhaps
能够 neng2gou4 to be capable of; to be able to; can
只能 zhi3neng2 can only; obliged to do sth; to have no other choice" 15
过 guo4 shui2/rang4/guo4/o2/guai4 "过 guo4 to cross; to go over; to pass (time); to celebrate (a holiday); to live; to get along; excessively; too-
不过 bu4guo4 only; merely; no more than; but; however; anyway (to get back to a previous topic); cannot be more (after adjectival)
过去 guo4qu5 (verb suffix)
通过 tong1guo4 to pass through; to get through; to adopt (a resolution); to pass (legislation); to pass (a test); by means of; through; via
过程 guo4cheng2 course of events; process" 16
等 deng3 qie1/deng3/pai3/bi2/chong4 "等 deng3 class; rank; grade; equal to; same as; to wait for; to await; et cetera; and so on; et al. (and other authors); after; as soon as; once
等等 deng3deng3 et cetera; and so on ...
等待 deng3dai4 to wait; to wait for
等到 deng3dao4 to wait until; by the time when (sth is ready etc)
等于 deng3yu2 to equal; to be tantamount to" 17
吧 ba5 pen1/men1/lu/hong4/ba5 "吧 ba5 (modal particle indicating suggestion or surmise); ...right?; ...ok?; ...i presume.
酒吧 jiu3ba1 bar; pub; saloon
吧嗒 ba1da5 to smack one's lips; to pull (on a pipe)
吧唧 ba1ji5 to smack one's lips" 18
走 zou3 ri4/yue3/cen2/zou3/ze4 "走 zou3 to walk; to go; to run; to move (of vehicle); to visit; to leave; to go away; to die (euph.); from; through; to change (shape, form, meaning)
走进 zou3jin4 to enter
走向 zou3xiang4 direction; strike (i.e. angle of inclination in geology); inclination; trend; to move towards; to head for
走过 zou3guo4 to walk past; to pass by
走去 zou3qu4 to walk over (to)" 19
更 geng4 geng4/pen4/lao1/lei1/cu1 "更 geng4 more; even more; further; still; still more
更加 geng4jia1 more (than sth else); even more
更是 geng4shi4 even more (so)
更新 geng1xin1 to replace the old with new; to renew; to renovate; to upgrade; to update; to regenerate
更为 geng4wei2 even more" 20
呢 ne xie3/ne/zhuang3/rang4/guo4 "呢 ne5 (at the end of a declarative sentence) particle indicating continuation of a state or action; particle indicating strong affirmation
着呢 zhe5ne5 comes at the end of the sentence to indicate a strong degree; quite; rather
呢喃 ni2nan2 whispering; murmuring
花呢 hua1ni2 tweed; checkered cloth" 21
吗 ma5 ma5/zhao2/chuang3/lou1/wa5  22
家 jia5 zhua1/pen4/jia5/zhou3/shao3 "家 jia1 home; family; (polite) my (sister, uncle etc); classifier for families or businesses; refers to the philosophical schools of pre-han china; noun suffix for a specialist in some activity, such as a musician or revolutionary, corresponding to english -ist, -er, -ary or -ian
大家 da4jia1 everyone; influential family; great expert
国家 guo2jia1 country; nation; state
家里 jia1li3 home
回家 hui2jia1 to return home" 23
啊 a2 a2/tuan2/e3/ga4/pou3 "啊 a5 modal particle ending sentence, showing affirmation, approval, or consent
啊呀 a1ya1 interjection of surprise" 24
啊 a3 ê4/run4/leng4/a3/kua3 "啊 a5 modal particle ending sentence, showing affirmation, approval, or consent
啊呀 a1ya1 interjection of surprise" 25
啊 a4 a4/niao4/en4/hao1/chuai3 "啊 a5 modal particle ending sentence, showing affirmation, approval, or consent
啊呀 a1ya1 interjection of surprise" 26
啊 a5 a5/guai1/ng3/sou4/ê3 "啊 a5 modal particle ending sentence, showing affirmation, approval, or consent
啊呀 a1ya1 interjection of surprise" 27
们 men5 li1/men5/ba5/bu1/ma "我们 wo3men5 we; us; ourselves; our
他们 ta1men5 they
们 men5 plural marker for pronouns, and nouns referring to individuals
你们 ni3men5 you (plural)
人们 ren2men5 people" 28
跟 gen1 na1/gen1/bi2/chong4/xue4 "跟 gen1 heel; to follow closely; to go with; (of a woman) to marry sb; with; compared with; to; towards; and (joining two nouns)
跟着 gen1zhe5 to follow after; immediately afterwards
跟前 gen1qian5 (of children, parents etc) at one's side; living with one
跟踪 gen1zong1 to follow sb's tracks; to tail; to shadow; tracking
跟随 gen1sui2 to follow" 29
怎 zen3 niu1/zen3/kao1/cen1/guang4 "怎么 zen3me5 how?; what?; why?
怎样 zen3yang4 how; what kind
怎么样 zen3me5yang4 how?; how about?; how was it?; how are things?
怎么办 zen3me5ban4 what's to be done
怎 zen3 how" 30
您 nin2 pai3/bo/nang3/nin2/jiao2  31
打 da3 da3/hang4/pao3/liu1/cuo3 "打 da3 to beat; to strike; to hit; to break; to type; to mix up; to build; to fight; to fetch; to make; to tie up; to issue; to shoot; to calculate; to play (a game); since; from
打开 da3kai1 to open; to show (a ticket); to turn on; to switch on
打电话 da3dian4hua4 to make a telephone call
打工 da3gong1 to work a temporary or casual job; (of students) to have a job outside of class time, or during vacation
打击 da3ji1 to hit; to strike; to attack; to crack down on sth; blow; (psychological) shock; percussion (music)" 32
谁 shei2 shei2/leng1/luo5/bu1/cai1 "谁 shei2 who
谁知 shei2zhi1 who would have thought; unexpectedly" 33
谁 shui2 mang1/cen1/hou3/che1/shui2 "谁 shei2 who
谁知 shei2zhi1 who would have thought; unexpectedly" 34
北 bei3 ba5/bei3/zhua3/ken4/ya3 "北京 bei3jing1 beijing, capital of the people's republic of china
北 bei3 north
东北 dong1bei3 northeast china; manchuria; northeast
北方 bei3fang1 north; the northern part a country; china north of the yellow river
西北 xi1bei3 northwest china (shaanxi, gansu, qinghai, ningxia, xinjiang); northwest" 35
买 mai3 pai3/dei3/nao1/mai3/tian4 "买 mai3 to buy; to purchase
购买 gou4mai3 to purchase; to buy
买房 mai3fang2 to buy a house
买票 mai3piao4 to buy tickets
买家 mai3jia1 buyer; purchaser" 36
写 xie3 diu1/xie3/bo/mou1/nin2 "写 xie3 to write
写作 xie3zuo4 to write; to compose; writing; written works
写信 xie3xin4 to write a letter
描写 miao2xie3 to describe; to depict; to portray; description
写下 xie3xia4 to write down" 37
发 fa4 weng3/fa4/bie4/xin3/mou3 "发现 fa1xian4 to notice; to become aware of; to discover; to find; to detect; a discovery
发展 fa1zhan3 development; growth; to develop; to grow; to expand
发 fa1 to send out; to show (one's feeling); to issue; to develop; to make a bundle of money; classifier for gunshots (rounds)
发生 fa1sheng1 to happen; to occur; to take place; to break out
发表 fa1biao3 to issue; to publish" 38
发 fa1 zao2/fa1/ni1/lie1/fo2 "发现 fa1xian4 to notice; to become aware of; to discover; to find; to detect; a discovery
发展 fa1zhan3 development; growth; to develop; to grow; to expand
发 fa1 to send out; to show (one's feeling); to issue; to develop; to make a bundle of money; classifier for gunshots (rounds)
发生 fa1sheng1 to happen; to occur; to take place; to break out
发表 fa1biao3 to issue; to publish" 39
车 che1 hou1/che1/ken4/che3/ng3 "车 che1 car; vehicle; machine; to shape with a lathe; kangxi radical 159
汽车 qi4che1 car; automobile; bus
火车 huo3che1 train
出租车 chu1zu1che1 taxi
自行车 zi4xing2che1 bicycle; bike" 40
拿 na2 nou4/kuan1/ê3/shai1/na2 "拿 na2 to hold; to seize; to catch; to apprehend; to take
拿出 na2chu1 to take out; to put out; to provide; to put forward (a proposal); to come up with (evidence)
拿起 na2qi3 to pick up
拿来 na2lai2 to bring; to fetch; to get
拿走 na2zou3 to take away" 41
内 nei4 ê3/mian4/sen1/nei4/ao3 "内 nei4 inside; inner; internal; within; interior
内容 nei4rong2 content; substance; details
国内 guo2nei4 domestic; internal (to a country); civil
内心 nei4xin1 heart; innermost being; (math.) incenter
内部 nei4bu4 interior; inside (part, section); internal" 42
女 nü3 nü3/feng3/da4/seng1/shai3 "女孩 nu:35hai2 girl; lass
女友 nu:35you3 girlfriend
女的 nu:35de5 woman
妓女 ji4nu:35 prostitute; hooker
女郎 nu:35lang2 young woman; maiden; girl" 43
水 shui3 na1/ng2/chun3/shui3/hou3 "水 shui3 water; river; liquid; beverage; additional charges or income; (of clothes) classifier for number of washes
水平 shui3ping2 level (of achievement etc); standard; horizontal
泪水 lei4shui3 teardrop; tears
水果 shui3guo3 fruit
水泥 shui3ni2 cement" 44
死 si3 sao3/duan3/si3/heng4/huan3 "死 si3 to die; impassable; uncrossable; inflexible; rigid; extremely; damned
死亡 si3wang2 to die; death
打死 da3si3 to kill; to beat to death
死去 si3qu4 to die
死者 si3zhe3 the dead; the deceased" 45
呀 ya5 na1/jue1/qu/ya5/peng4 "哎呀 ai1ya1 interjection of wonder, shock or admiration
啊呀 a1ya1 interjection of surprise" 46
放 fang4 sheng3/ang4/fang4/o4/hou3 "放 fang4 to put; to place; to release; to free; to let go; to let out; to set off (fireworks)
放弃 fang4qi4 to renounce; to abandon; to give up
开放 kai1fang4 to bloom; to open; to be open (to the public); to open up (to the outside); to be open-minded; unrestrained by convention; unconstrained in one's sexuality
放心 fang4xin1 to feel relieved; to feel reassured; to be at ease
放下 fang4xia4 to lay down; to put down; to let go of; to relinquish; to set aside; to lower (the blinds etc)" 47
通 tong1 ca1/tong1/lei/ê3/chong3 "通过 tong1guo4 to pass through; to get through; to adopt (a resolution); to pass (legislation); to pass (a test); by means of; through; via
通 tong1 to go through; to know well; (suffix) expert; to connect; to communicate; open; to clear; classifier for letters, telegrams, phone calls etc
交通 jiao1tong1 to be connected; traffic; transportation; communications; liaison
普通 pu3tong1 common; ordinary; general; average
通知 tong1zhi1 to notify; to inform; notice; notification" 48
别 bie4 peng4/bie4/juan3/ng4/bu2 "特别 te4bie2 unusual; special; very; especially; particularly; expressly; for a specific purpose
别 bie2 to leave; to part (from); (literary) to differentiate; to distinguish; (bound form) other; another; different; to fasten with a pin or clip; to stick in; to insert (in order to hinder movement)
别人 bie2ren5 other people; others; other person
别的 bie2de5 else; other
分别 fen1bie2 to part; to leave each other; to distinguish; to tell apart; difference; distinction; in different ways; differently; separately; individually" 49
外 wai4 juan3/wai4/qu/pai3/luo1 "外 wai4 outside; in addition; foreign; external
另外 ling4wai4 additional; in addition; besides; separate; other; moreover; furthermore
国外 guo2wai4 abroad; external (affairs); overseas; foreign
外国 wai4guo2 foreign (country)
之外 zhi1wai4 outside; excluding" 50
作 zuo1 su2/hang1/zuo1/hong4/ng2 "工作 gong1zuo4 to work; (of a machine) to operate; job; work; task
作者 zuo4zhe3 author; writer
作 zuo4 to do; to engage in; to write; to compose; to pretend; to feign; to regard as; to consider to be; to be; to act the part of; to feel (itchy, nauseous etc); writings; works
作为 zuo4wei2 one's conduct; deed; activity; accomplishment; achievement; to act as; as (in the capacity of); qua; to view as; to look upon (sth as); to take sth to be
作品 zuo4pin3 work (of art); opus" 51
片 pian4 nüe4/quan4/leng3/pian4/nian1 "片 pian4 thin piece; flake; a slice; film; tv play; to slice; to carve thin; partial; incomplete; one-sided; classifier for slices, tablets, tract of land, area of water; classifier for cds, movies, dvds etc; kangxi radical 91
照片 zhao4pian4 photograph; picture
图片 tu2pian4 image; picture; photograph
影片 ying3pian4 a copy of a film; film; motion picture; movie
唱片 chang4pian4 gramophone record; lp; music cd; musical album" 52
总 zong3 sheng2/zong3/si3/nü4/bai1 "总 zong3 general; overall; to sum up; in every case; always; invariably; anyway; after all; eventually; sooner or later; surely
总是 zong3shi4 always
总统 zong3tong3 president (of a country)
总结 zong3jie2 to sum up; to conclude; summary
总理 zong3li3 premier; prime minister" 53
难 nan4 jue4/nan4/wang2/bei3/guai1 "难 nan2 difficult (to...); problem; difficulty; difficult; not good
难道 nan2dao4 don't tell me ...; could it be that...?
困难 kun4nan5 difficult; challenging; straitened circumstances; difficult situation
难以 nan2yi3 hard to (predict, imagine etc)
难过 nan2guo4 to feel sad; to feel unwell; (of life) to be difficult" 54
参 cen1 cen1/lou5/mi1/chai3/guai4 "参加 can1jia1 to participate; to take part; to join
参与 can1yu4 to participate (in sth)
参观 can1guan1 to look around; to tour; to visit
参考 can1kao3 consultation; reference; to consult; to refer
参 can1 to take part in; to participate; to join; to attend; to counsel; unequal; varied; irregular; uneven; not uniform" 55
少 shao3 ti3/mian4/shao3/ya3/zan2 "多少 duo1shao5 how much?; how many?; (phone number, student id etc) what number?
少 shao3 few; less; to lack; to be missing; to stop (doing sth); seldom
不少 bu4shao3 many; a lot; not few
至少 zhi4shao3 at least; (to say the) least
减少 jian3shao3 to lessen; to decrease; to reduce; to lower" 56
口 kou3 gen3/lo5/kou3/cai1/pian4 "口 kou3 mouth; classifier for things with mouths (people, domestic animals, cannons, wells etc); classifier for bites or mouthfuls
门口 men2kou3 doorway; gate
出口 chu1kou3 an exit; to speak; to export; (of a ship) to leave port
人口 ren2kou3 population; people
窗口 chuang1kou3 window; opening providing restricted access (e.g. customer service window); computer operating system window; fig. medium; intermediary; showpiece; testing ground" 57
啦 la5 pen2/wai4/nao1/la5/cun4 "啦 la5 particle placed after each item in a list of examples
哗啦 hua1la1 with a crash" 58
哪 na3 chao4/na3/nong4/dia3/ne2 "哪 na3 how; which
哪个 na3ge5 which; who
哪些 na3xie1 which ones?; who?; what?
哪怕 na3pa4 even; even if; even though; no matter how
哪知 na3zhi1 who would have imagined?; unexpectedly" 59
哪 na5 na3/ti3/na5/ê1/que2 "哪 na3 how; which
哪个 na3ge5 which; who
哪些 na3xie1 which ones?; who?; what?
哪怕 na3pa4 even; even if; even though; no matter how
哪知 na3zhi1 who would have imagined?; unexpectedly" 60
哪 ne2 duan3/ne2/rui2/gen3/gun4 "哪 na3 how; which
哪个 na3ge5 which; who
哪些 na3xie1 which ones?; who?; what?
哪怕 na3pa4 even; even if; even though; no matter how
哪知 na3zhi1 who would have imagined?; unexpectedly" 61
卡 qia3 rang4/qia3/la5/shai1/chao3 "卡 ka3 to stop; to block; (computing) (coll.) slow; cassette
卡车 ka3che1 truck
卡片 ka3pian4 card
卡尔 ka3er3 karl (name)
卡特 ka3te4 carter (name)" 62
法 fa3 zhou3/fa3/huan1/guai3/luan4 "无法 wu2fa3 unable; incapable
方法 fang1fa3 method; way; means
法 fa3 france; french; law; method; way; to emulate; law
办法 ban4fa3 means; method; way (of doing sth)
法国 fa3guo2 france; french" 63
跑 pao3 jie5/rui2/li5/pao3/zu1 "跑 pao3 to run; to run away; to escape; to run around (on errands etc); (of a gas or liquid) to leak or evaporate; (verb complement) away; off
跑步 pao3bu4 to run; to jog; (military) to march at the double
逃跑 tao2pao3 to flee from sth; to run away; to escape
奔跑 ben1pao3 to run
跑出 pao3chu1 to run out" 64
怕 pa4 pa4/ga4/ng2/shai1/mai2 "怕 pa4 to be afraid; to fear; to dread; to be unable to endure; perhaps
害怕 hai4pa4 to be afraid; to be scared
恐怕 kong3pa4 fear; to dread; i'm afraid that...; perhaps; maybe
不怕 bu4pa4 fearless; not worried (by setbacks or difficulties); even if; even though
可怕 ke3pa4 awful; dreadful; fearful; formidable; frightful; scary; hideous; horrible; terrible; terribly" 65
整 zheng3 zao2/zheng3/tang4/za2/juan3 "整个 zheng3ge4 whole; entire; total
调整 tiao2zheng3 to adjust; adjustment; revision
整 zheng3 exactly; in good order; whole; complete; entire; in order; orderly; to repair; to mend; to renovate; (coll.) to fix sb; to give sb a hard time; to mess with sb
整理 zheng3li3 to arrange; to tidy up; to sort out; to straighten out; to list systematically; to collate (data, files); to pack (luggage)
整体 zheng3ti3 whole entity; entire body; synthesis; as a whole (situation, construction, team etc); global; macrocosm; integral; holistic; whole" 66
拍 pai1 da/rong3/sang4/qia2/pai1 "拍 pai1 to pat; to clap; to slap; to swat; to take (a photo); to shoot (a film); racket (sports); beat (music)
拍摄 pai1she4 to take (a picture); to shoot (a film)
拍照 pai1zhao4 to take a picture
拍卖 pai1mai4 to auction; auction sale; to sell at a reduced price
拍打 pai1da5 to pat; to slap; (of a bird) to flap (one's wings)" 67
算 suan4 mou3/che1/xue3/nei4/suan4 "算 suan4 to regard as; to figure; to calculate; to compute
算是 suan4shi4 considered to be; at last
计算机 ji4suan4ji1 computer
就算 jiu4suan4 (coll.) even if
计算 ji4suan4 to count; to calculate; to compute" 68
白 bai2 ma/san4/bai2/mou1/dei1 "明白 ming2bai5 clear; obvious; unequivocal; to understand; to realize
白 bai2 white; snowy; pure; bright; empty; blank; plain; clear; to make clear; in vain; gratuitous; free of charge; reactionary; anti-communist; funeral; to stare coldly; to write wrong character; to state; to explain; vernacular; spoken lines in opera
白色 bai2se4 white; fig. reactionary; anti-communist
白酒 bai2jiu3 baijiu, a spirit usually distilled from sorghum
苍白 cang1bai2 pale; wan" 69
根 gen1 gen1/nie1/ang4/shun3/xiong4 "根本 gen1ben3 fundamental; basic; root; simply; absolutely (not); (not) at all
根据 gen1ju4 according to; based on; basis; foundation
根 gen1 root; basis; classifier for long slender objects, e.g. cigarettes, guitar strings; radical (chemistry)
根源 gen1yuan2 origin; root (cause)
压根 ya4gen1 (mainly used in the negative) in the first place; absolutely; simply" 70
远 yuan3 hou3/chen3/yuan3/ê3/ming4 "远 yuan3 far; distant; remote; (intensifier in a comparison) by far; much (lower etc)
永远 yong3yuan3 forever; eternal
远远 yuan3yuan3 distant; by far
远处 yuan3chu4 distant place
遥远 yao2yuan3 distant; remote" 71
存 cun2 sheng3/cun2/qie1/xue4/ang2 "存在 cun2zai4 to exist; to be; existence
生存 sheng1cun2 to exist; to survive
存 cun2 to exist; to deposit; to store; to keep; to survive
保存 bao3cun2 to conserve; to preserve; to keep; to save (a file etc) (computing)
存款 cun2kuan3 to deposit money (in a bank etc); bank savings; bank deposit" 72
面 mian4 shi/shuang3/bei3/nan1/mian4 "方面 fang1mian4 respect; aspect; field; side
面 mian4 face; side; surface; aspect; top; classifier for objects with flat surfaces such as drums, mirrors, flags etc; flour; noodles; (of food) soft (not crunchy); (slang) (of a person) ineffectual; spineless
面前 mian4qian2 in front of; facing; (in the) presence (of)
后面 hou4mian5 the back; the rear; the last bit; behind; near the end; at the back; later; afterwards
面对 mian4dui4 to face; to confront" 73
转 zhuan3 le/ze4/xiong4/heng4/zhuan3 "转 zhuan3 to turn; to change direction; to transfer; to forward (mail); (internet) to share (sb else's content)
转载 zhuan3zai3 to forward (a shipment); to reprint sth published elsewhere
转身 zhuan3shen1 (of a person) to turn round; to face about; (of a widow) to remarry (archaic)
转移 zhuan3yi2 to shift; to relocate; to transfer; (fig.) to shift (attention); to change (the subject etc); (medicine) to metastasize
转变 zhuan3bian4 to change; to transform; shift; transformation" 74
价 jie5 qie2/tui3/kuang3/jie5/ng2 "价格 jia4ge2 price
价值 jia4zhi2 value; worth; fig. values (ethical, cultural etc)
评价 ping2jia4 to evaluate; to assess
价 jia4 price; value; (chemistry) valence
代价 dai4jia4 price; cost; consideration (in share dealing)" 75
套 tao4 ga4/shuan4/tao4/zong3/xu2 "套 tao4 to cover; to encase; cover; sheath; to overlap; to interleave; to model after; to copy; formula; harness; loop of rope; (fig.) to fish for; to obtain slyly; classifier for sets, collections; bend (of a river or mountain range, in place names)
配套 pei4tao4 to form a complete set; compatible; matching; complementary
